question,answer
meditation mindfulness - How can I know that I am clear of thoughts while I am meditating?,"
There are multiple kinds of mental phenomena, not all of which can be classified as thoughts.
First and the crudest kind, are visualizations, cravings, and replays. This is when we mentally leave here and now, and are experiencing what basically is a (short or long) daydream about the subject our mind is concerned or agitated about.
The second kind are mental chatter. This is when we think in words, silently saying them in our head. If you look carefully you will notice how the muscles of the tongue and lips are slightly engaged as you ""pronounce"" your inner speeches.
The third kind is conceptual thinking. This is when we mentally follow a chain of logical relationships between objects or concepts. These are still thoughts.
The fourth kind is labeling. This is when we mentally recognize phenomena we experience and identify them with a category or attribute that makes them distinct, given the context.
The fifth kind is registering. This is when we make a mental note of experience without labeling it to any category. For the purposes of this answer, these are the borderline between thoughts and non-conceptual experiences.
The sixth kind is non-conceptual perception. This is when we experience (see, hear, smell) or feel (a bodily sensation or emotion), without labeling, acknowledging or noting it in any way. Famous technique used by Zen masters to awaken one to this level is to make a sudden noise in the middle of long meditation session.
The seventh kind is perception of energy. This is when we feel chakras and meridians.
The eighth kind is samadhi. This can't be described in words and must be experienced to be understood.
When we say ""my thinking has stopped"", we usually mean levels 1-4, while levels 6-8 can still function. This said, it is not like in meditation our goal is to stop thinking. Rather, it is to open ourselves to levels 6-8. As we get better at this, thinking can go on ""in the background"" without affecting our meditation.
"
Does the concept of evil spirits occur in Buddhism?,"
It's not always as clear as 'good' or 'evil'. Angry, vengeful spirits also exist in forms of Buddhism. Sometimes also seen as protectors, they can be a source of controversy.
More common is one's own belief in (or, more practically, fear of) something that is indefinitely, and irreparably, sinister or evil. We subscribe to all sorts of interesting notions as children, some things tend to persist. Ultimately, it's what your mind manages to trick you into into feeling; there are plenty of Christians that don't believe that demons exist so it really does depend on the individual.
So, yes to the concept (with emphasis on what neubau mentions about indigenous spirits), but belief is a little more complicated; belief coupled with a healthy dose of ambivalence can be quite common.
For children, I think the boogeyman is rather universal :)
"
ethics - Should Buddhist teachers get rich?,"
I don't think there is a definite answer to this question. Bear in mind that Buddha did not give any commandments in form of 'do' and 'do not'. He rather gave guidelines and various methods that are suited for various types of people.
The fact that one style goes against your preferences, does not mean that someone else cannot benefit from that. To practise Buddhism one should try not to judge others and focus on his own development.
It should be clearly said, however, that generosity is the first Paramita (liberating action or perfection). Through practising the 6 Paramitas, one can break the cycle of samsara and offering goods to the Dharma teacher is though to be a great act of generosity and it creates lots of merit in practitioner's mind. Bearing that in mind, I can think of the following reasons why there is a lot of wealth around some teachers:

a teacher has a very generous and rich sponsor who made promises to always provide for his teacher
a city where the teacher lives is not the safest one and the Sangha (community of practitioners) donated money so that the teacher stays in a safe environment. They also want the teacher to be healthy and have a long life, so they will always cook the best food for him and will call for the best (usually most expensive) doctors.
expensive cars means that they are reliable and won't break a lot so that the teachers can travel safely to spread the teachings. Same for expensive computers and phones.
it is also an act of generosity to give others opportunity to pay money towards the Buddhist teachings. It is better if people pay hundreds of dollars for the teachings rather than in a casino.

The problem arises when the teacher abuses generosity of his students but we are not the ones to judge them. If they use Dharma to get rich, be sure there will be some karmic consequences. 
Personally, I am not attracted to teachers who charge a lot for teachings. I trusted a teacher who is low-profile so I can relax and donate as much money as I want and can afford. Other people, however, prefer developing with their teacher in a palace and if it works for them, we can only be happy that the Dharma spreads.
"
