question,answer
"What are the main differences between the Theravada, Mahayana and Vajrayana branches of Buddhism?","
This question, indeed, requires a whole book in order to be answered completely. Let me address only Theravada and Mahayana here.
In two words:

The most important aspect is that Theravada is focused on your own liberation from suffering, while Mahayana is targeted to all sentient creatures;
There are many consequences here:

Theravada assumes that you have to practice for yourself, while others can only suggest you. Mahayana says that you can (and have to) share your experience and accomplishments with others, thus making followers for yourself;
Theravada suggests to seek enlightenment for yourself first; Mahayana is up to delaying breaking off Samsara in order to help others;
Theravada practices are mostly silent and very personal while in Mahayana it is more often ""wrapped"" in some collective rituals like chanting;

In Theravada, the final goal for a Bodhisattva is nirvana. In Mahayana, prominence is important by itself;
Each teaching is more or less localized, e.g. at a certain country/territory there's usually only one;
If you'd like to read scriptures in original language, you should be aware that Theravada is written in Pali (Pali Cannon) while Mahayana is written in Sanskrit (Sutras);

Of course, there are also big differences in texts, ritual, etiquette, and so on.
This Comparative Study between two traditions provide with greater details.
"
Does rebirth or reincarnation occur in Buddhism?,"
Disclaimer: My answer to this will be non-exhaustive. My answer will be scoped as close to that of the question as possible. (General). I will also answer your question (which is actually 4) piece by piece.

You asked:

Does reincarnation/rebirth occur in Buddhism?

Yes it does. The concept of rebirth and reincarnation in Buddhism is complex and can differ slightly or largely from tradition to tradition however.
You asked:

Will everyone be reborn?

Every sentient being (people, animals, etc) is in a cycle of rebirth. They will all be reborn after death. The only exclusion to this will depend on the tradition. Most traditions, in a general sense, state that one may leave the cycle of rebirth if they attain enlightenment or nirvana. This is only possible when you are a human, though. 
You asked:

Are people always reborn as people?

The answer is no. Please see next section of this answer for elaboration.
You asked:

How is rebirth/reincarnation handled in Buddhism?

In Buddhism, there exists the concept of Samsara. This is the continuous cycle of rebirth throughout six different realms. These realms include the realm of Gods, Titans, Hungry Ghosts, Hell, Animals, and Humans. One may be considered more preferable to another, for example Gods to Hell, yet all are imperfect and involve some level of suffering. Depending on past lives and karma, one will move from realm to realm during each rebirth. The Human realm is generally considered to be the best because it is the only one in which one may obtain enlightenment and exit from this wheel of Samsara and therefore end the cycle of rebirth and suffering.
For more information, you may find this article to be useful.

Side Note: My professor of Eastern Religions once told me that being in this cycle of rebirth can be a great source of anxiety, hence one source of motivation to exit from it.
"
learning materials - Introductory books to Buddhism,"
First off, I wouldn't recommend Tibetan Book of the Dead, since it's not exactly a primer in Buddhism, I don't think. There are lots of introductions from various traditions; the perennial favourite is What the Buddha Taught by Walpola Rahula. He's also written pieces on the difference (or lack thereof) between the various schools, so he's pretty unbiased that way.
Indian Buddhism by A.K. Warder is a great in-depth look at how Buddhism evolved, though like everything by the author it is terribly dense.
Bhikkhu Bodhi is another modern author who has some good resources; his introductions to the nikayas, e.g. in The Middle Length Discourses of the Buddha, are well-done. He also has an audio series on-line about the same that seems well-received.
I guess I'd be careful about modern sources either from the West or East as an introduction, since without a solid background, it will be easy to become swayed by skewed teachings. Reading the words of the historical Buddha himself would most likely help to provide such a background. Again Bodhi's translations are a good choice.
"
The spiritual significance of the sand mandala in Tibetan Buddhism,"
According to The Tibetan Monks of Drepung Gomang Monastery



When finished, to symbolize the impermanence of all that exists, the colored sands are swept up and poured into a nearby river or stream where the waters carry healing energies throughout the world.


In general, all mandalas have outer, inner, and secret meaning.  On the outer level they represent the world in its divine form; on the inner level, they represent a map by which the ordinary human mind is transformed into the enlightened mind; and on the secret level, they predict the primordially perfect balance of the subtle energies of the body and the clear light dimension of the mind.  The creation of a sand painting is said to affect purification and healing on these three levels.



"
What is the purpose of using a wand to hit a monk in Zen meditation?,"
Supposedly it is used to help meditator fight drowsiness. It is said that drowsiness comes from stiffness, from meditator trying to artificially restrict their micro-movements and to severely narrow their scope of attention. While right concentration is said to feel open and flexible, with body actively balancing in meditation posture and attention wide open (but not engaged nor scattered). When supervising monk sees somebody nodding, he reminds meditator of the need to expand their awareness, by gently ""massaging"" the shoulder with the stick :)
"
What is the difference between rebirth and reincarnation?,"
Reincarnation implies a soul that takes a body; rebirth does not, so it is preferred.
Note that neither term has a widely used cognate in the Pali texts, perhaps because the concept of ""re-"" anything implies the continuation of an entity. Buddhism tends to talk about birth and death in a more linear fashion; rather than being reborn, it's ""being born again"" (e.g. dukkhā jāti punappunaṃ).
Further, the focus in Buddhism is on individual mind states and ultimate reality rather than the conceptual reality of birth and death, so it's not really a core teaching. Death is a concept; at the moment of a being's death, one body/mind experience ceases and the next one arises, just as it did through the entire life.
"
"terminology - What, precisely, is kamma/karma?","
There are two main interpretations of how karma is accumulated.
In Sarvastivada branch of philosophy, past actions can be directly related to new consequences, because fundamentally ""everything exists"" and only the modus of time changes. As things aren't losing the status of existence, they can cause new things. There is a special additional property (called prapti) to relate or un-relate action to the stream of consciousness. So when you perform an action it doesn't need anything else to be able to cause karmical fruit. (Of course it requires other conditions to work.)
In Sautrantika branch of philosophies, actions are accumulated by means of traces (bija-vasanas) in some sort of storehouse consciousness (alaya-vijnana). It works similarly to when you plant the seed of a tree into the ground; the seed disappears but the tree still contains the ability to ripen into certain fruits. Thus, action could be accumulated in something completely different from the action itself. So when you act, you actually change yourself as a whole in a way that accumulates the potential to acquire karmic fruit.
Yes, intention is kamma, but there are two types of kamma (SN 35.145) old kamma and new kamma. Where new kamma is intention (as thinking) and what-is-after-intention (actions of speech and body), while old kamma is your body as whole (i.e. the totality of all organs). In that way you have your old kamma always with yourself in your body (including all organs of perception and intellect).
"
nirvana - Is it harmful to the Buddha when we request he or she to continue teaching instead of entering parinirvana?,"
As I pointed out in my answer to ""are earthworms our mothers?""  these kind of questions often assume incorrect frame of reference. The reason we request Buddha (or our local teacher as Buddha's substitute) to continue teaching instead of entering parinirvana, is not because it can literally make Buddha (or teacher) change their mind and stay. The idea is to create a mental context in which A) the teacher feels motivated to continue teaching because he sees the teaching is in demand, B) the students stay aware of the fact that existence of the teaching in this world depends solely on Buddha and then generations of teachers passing it to one another, and now to the students, and C) the student clearly realizes that the teacher could very well leave this place but is instead making effort to stay and teach solely out of compassion for the students. When this context is established the teaching can happen effectively, because both the sides will engage actively and with no resistance.
Granted these are entry-level practices, but they are very important to establish as foundation. Otherwise what happens if you skip straight to advanced teaching, the student may get as arrogant as to metaphorically grab the teacher by the hair and swing around. Needless to say, it hurts the student first and foremost.
"
Do Arhats slp? - Buddhism Stack Exchang,"
According to the teachings I received, once the practitioner attains certain level of mastery in meditation, their sleep acquires a character of meditation. It's not like they don't sleep at all, but they do retain certain level of deep awareness during their sleep.
Specifically, when they see a dream, they know it's a dream. They remain aware of their body lying down on the bed. They remain aware of the content of their consciousness no matter how disjointed it gets during a deep sleep. If something happens around them, they wake up easily to provide their help if needed.
"
What are the major sects of Buddhism?,"
Mahayana is not a sect at all; it is a vehicle.
Major traditions in Buddhism are usually country or region related. We can distinguish three major branches of Buddhism in the World by what they keep as canon.

Tibetan, Mongolian, and Russian Buddhism share Tibetan canon.
Chinese, Japanese, and Korean Buddhism share Chinese canon.
Sri Lanka, Burma, Thailand, etc share Pali canon.

Some countries mix several aforementioned branches.
"
sects - Is there an Orthodox Buddhism?,"
Well, Theravada is often argued to hew most closely to the original teachings of the Buddha. See, e.g. ""Two Main Schools of Buddhism"" for a very brief overview of this. 
As I understand it, this has much to do with the fact that Theravada is the oldest of the extant Buddhist schools of thought, predating Mahayana by a few centuries. Theravada practice is also more localized to geographic regions nearer the birthplace of Buddhism (that is, Sri Lanka and Southeast Asia), and never strayed far from it; this is thought to have contributed to the ""orthodoxy"" of the school - it mixed less with other intellectual and spiritual traditions.
Additionally, Theravada Buddhists draw primarily on the Pali Canon (the Tripitaka), whereas Mahayana Buddhists draw primarily on Chinese sources. These Chinese sources are relatively more distant from the original teachings of the Buddha in terms of both time and language. As a byproduct of this, the Pali texts are often more ""authentic"".1
That said, the term ""Orthodox"" has no specific meaning in the context of Buddhism, i.e. there is no such school as ""Orthodox Buddhism"". There are only lowercase-o ""orthodox schools of Buddhism"", and what counts as ""orthodox"" will probably differ depending on who you ask. I should add that pre-sectarian Buddhism is almost definitionally the most ""orthodox"" school of Buddhist thought. The only problem is that, well, it doesn't exist anymore.

1 See, e.g. Rupert Gethin's The Foundations of Buddhism, p. 44: ""it is likely that [it] is generally the case [...] that the traditions [the Pali recension] preserves are [...] the oldest and most authentic available to us"" (elisions/etc because the original sentence was inverted)
"
Does studying mathematics or science lead to a practitioner of Buddhism acquiring wrong philosophical views and mental afflictions?,"
If you are looking for enlightenment you should be concerned of not being attached to these studies, or averse to what you disagree. The same fits to Buddhism itself, you should't become absorbed, or obsessed, to the Dharma.
All philosophies are mental phenomena, they aren't either good or bad in themselves. But they can hinder your search for enlightenment if you are too concerned about them.
Math and science share a side of problem elaboration and solving. So it would contradict Buddhism if you enjoy or think it is meaningful to be worried about all those problems. Over-thinking about anything and having a heavy attitude over theories or facts are opposite to the practice of meditation.
The point of meditation is to not being absorbed to mental elaborations. So there is no sense to think all over a sitting session. Then this extends to daily life, there is no sense to have a sharp and clear mind when meditating and daydream in the rest of the time.
For short, the point isn't what phenomena you engage, but it's how you engage to phenomena. If you can elaborate on any philosophy in a detached way it wouldn't be a problem at all. So the practice would be to think while being present and aware. (yes, this one is quite paradoxical)
"
five precepts - Is killing vermin and insects justifiable?,"
The beauty of the precepts is that they are impossible for ordinary human beings to fully observe.  The precept against killing is an example of this. My body's immune system kills all lifeforms that it doesn't recognize.  I step on and crush innumerable microorganisms.  But the first precept asks us to minimize the amount of harm we do in the world.  In the teachings of Thich Nhat Hanh, the precepts are trainings, not commandments.
"
iconography - Why should we worship statues of Lord Buddha?,"
I am not sure we should worship statues itself as that would be some sort of idolatry. Buddhists worship Buddha, and statue or other image is just symbol, something that bring into our memory good qualities of Buddha. It's mindfulness of Buddha. Statue is a symbol, and symbol is communication which states about its subject, Buddha in our case. Thus, showing respect before statue should be directed to Buddha as Jewel, and not to statue. Mindfulness and respect to the Saint and Teacher is good action.
Btw, Buddha is not disappeared, he stated that he will remain in his Teaching (Dharma).
"
Are there any differences in karma?,"
The difference will always be the mental state of the person performing the action. Giving is dependent on one's state of mind while giving; the amount is intrinsically inconsequential (though obviously a poor person will feel more strongly about giving $1000 than giving $1). As Sakka, king of the devas of Tavatimsa says in the Vimanavatthu:

""Natthi citte pasannamhi, appikā nāma dakkhiṇā;
Tathāgate vā sambuddhe, atha vā tassa sāvake""ti. (vi. va. 804);
There is not, when the mind is confident, such a thing as a small gift,
In regards to a Tathagata, fully enlightened Buddha or, furthermore, his disciples.

Giving to the Buddha is considered to be of greater merit, not because of the benefit to the Buddha, but because of the ability to inspire faith and confidence in the giver.
As for killing, the mental state involved in killing large animals is generally more intense; also the sense of the weight of the act is greater, so the mind will be more strongly affected by it. Killing virtuous people, parents, etc. is even worse, because it sets one squarely against virtue.
But there is no hard and fast rule here either; if you obsess over killing a single mosquito buzzing over you at night, you may cultivate more unwholesomeness than a single act of killing a larger animal.
Furthermore, karma isn't a single act of killing; it may be cultivated every moment; every thought concerning a moral or immoral act is karmically potent, so it's imprecise to ask if x or y is good or bad, better or worse, since karma is only a single thought moment at a time, and thus the potency depends upon the nature of the individual mind states.
"
What is the role of karma in rebirth?,"

In reincarnation, an individual's karma results in a better or worse
  next life for their soul. But in rebirth, there is no soul. So why
  should we care about our karma regarding our rebirth?

There is no Soul, but still there is consciousness. All suffering we are experiencing now  (in this life) is caused by past unwholesome deeds. So why cause suffering for future life? Yes, that person will not know about us, but still his consciousness will be in our stream of consciousness, related to ours, and even though we will not know why, we will suffer (or enjoy fruits of wholesome deeds).
Different argument. Basically, consciousness in our current life is as changing as between the lives. So, from this point of view, there is no difference when to suffer (or enjoy) - in the future of this or next life. If you don't want to suffer in this life why would you cause suffering in the next?
"
rebirth - What is it that is re-incarnated ?,"
There is neither not self nor self.
The five aggregates; form, sensation, perception, mind formations and consciousness; disperse at death.
Consciousness is life-force. By itself it is without physical form, all types of mental habits, thoughts, ideas, prejudices, compulsions, decisions, familiarity and judgement as to whether an object is pleasant, unpleasant or neutral.
The stream of consciousness passes from one life to another; during this process it is not entirely the same nor entirely different. With the cessation of consciousness samsara ceases.
"
laws - Buddhist teachings on nation building & politics,"
The clearest example of this that I can think of is in the Mahaparinibbana Sutta (DN 16) where the Buddha was asked (obliquely) by the brahman Vassakara on behalf of King Ajatasattu whether he had a chance at killing off an enemy nation. The Buddha replied with the seven ""Conditions of a Nation's Welfare"":

At that time the Venerable Ananda was standing behind the Blessed One, fanning him, and the Blessed One addressed the Venerable Ananda thus: ""What have you heard, Ananda: do the Vajjis have frequent gatherings, and are their meetings well attended?""
""I have heard, Lord, that this is so.""
""So long, Ananda, as this is the case, the growth of the Vajjis is to be expected, not their decline.
""What have you heard, Ananda: do the Vajjis assemble and disperse peacefully and attend to their affairs in concord?""
""I have heard, Lord, that they do.""
""So long, Ananda, as this is the case, the growth of the Vajjis is to be expected, not their decline.
""What have you heard, Ananda: do the Vajjis neither enact new decrees nor abolish existing ones, but proceed in accordance with their ancient constitutions?""
""I have heard, Lord, that they do.""
""So long, Ananda, as this is the case, the growth of the Vajjis is to
be expected, not their decline.
""What have you heard, Ananda: do the Vajjis show respect, honor,
esteem, and veneration towards their elders and think it worthwhile to
listen to them?""
""I have heard, Lord, that they do.""
""So long, Ananda, as this is the case, the growth of the Vajjis is to
be expected, not their decline.
""What have you heard, Ananda: do the Vajjis refrain from abducting
women and maidens of good families and from detaining them?""
""I have heard, Lord, that they refrain from doing so.""
""So long, Ananda, as this is the case, the growth of the Vajjis is to
be expected, not their decline.
""What have you heard, Ananda: do the Vajjis show respect, honor,
esteem, and veneration towards their shrines, both those within the
city and those outside it, and do not deprive them of the due
offerings as given and made to them formerly?""
""I have heard, Lord, that they do venerate their shrines, and that
they do not deprive them of their offerings.""
""So long, Ananda, as this is the case, the growth of the Vajjis is to
be expected, not their decline.
""What have you heard, Ananda: do the Vajjis duly protect and guard the
arahats, so that those who have not come to the realm yet might do so,
and those who have already come might live there in peace?""
""I have heard, Lord, that they do.""
""So long, Ananda, as this is the case, the growth of the Vajjis is to
be expected, not their decline.""

http://www.accesstoinsight.org/tipitaka/dn/dn.16.1-6.vaji.html
Besides being one of the few examples of the Buddha offering advice on how to run a nation (he was the one who taught the Vajjis these conditions), it also shows how the Buddha never did take sides in political struggle; rather than chastising Ajatasattu, he just taught the dhamma as he always did.
"
bon - Syllables and Prayers During Guru Yoga,"
Just the prayer and syllables in question, not the surrounding prayers and other elements of the practice (e.g., the refuge prayer), but this is the prayer that I was thinking of (བླ་མའི་རྣལ་འབྱོར, called the ""lamai naljor prayer"", also transliterated as ""lamé naljor"", or translated as ""Guru Yoga prayer""):

སྤྱི་གཙུག་བདེ་བ་ཆེན་པོའི་ཕོ་བྲང་དུ།
  དྲིན་ཆེན་རྩ་བའི་བླ་མ་ལ་གསོལ་བ་འདེབས།
  སངས་རྒྱས་སེམས་སུ་སྟོན་པ་རིན་པོ་ཆེ།
  རང་ངོ་རང་གིས་ཤེས་པར་བྱིན་གྱིས་རློབས།

Transliterated:

Chi tsuk dé wa chen pö po drang du
  Drin chen tsa wé la ma la söl wa dep
  Sang gyé sem su tön pa rin po ché
  Rang ngo rang gi shé par jin gyi lop

It has been translated as:

On the crown of my head, in a palace of great bliss
  Benevolent root lama, I pray to you.
  Precious one that reveals that my own mind is Buddha,
  Bless me to recognize my own true nature.

I have also seen it translated a little more poetically:

From the crown of my head, palace of great bliss,
  I pray to you, benevolent root lama.
  O precious one, grant me the blessings
  To recognize my own true nature as a Buddha.

There is a version of this practice found in Opening the Door to Bön by Latri Khenpo Geshe Nyima Dakpa Rinpoche, in the 5th preliminary practice, ""Connecting With the Teacher"", which provides a virtually identical prayer with a slightly different transliteration and another translation.
It also includes a lot of the surrounding details, visualizations, and prayers. This version of the practice is subtly different from the one that I learned, but the bones are very similar if not identical. 
The three syllables are:

AH – White, Forehead
OM – Red, Throat
HUNG – Dark Blue, Mind

These are Bön-specific seed syllables and other branches sometimes use variations. 
I don't own the book and so can't speak to its contents in any great detail, but Dilgo Khyentse Rinpoche has written a book called Guru Yoga: According To The Preliminary Practice Of Longchen Nyingtik would seem to cover the practice from a different angle. 
"
"philosophy - Relationship between Buddhism, Hinduism and Yoga?","
Hinduism & Yoga aren't 2 different things. They are the same. 
Yoga is one of the 6 main Darshanas of Hinduism. I.e it provides it's own path for liberation. Other Darshanas(Advaita, etc) too use Yoga as a valid means but not the only valid means. 
Can't really say Buddhism is modern. It evolved along with Yoga both of which can be traced to around 4th century BCE. 
Both Hindu Darshanas & Buddhism evolved influencing each other. For example Advaita borrowed some of it's elements from Nagarjuna. Tibetan Buddhism incorporated Tantra which is considered 'Hindu'. 
Tibetan Buddhism has it's own version of Yoga called Trul khor.
Hence to answer your question, they all belong to the same family, the Dharmic family and have influenced each other.
"
hinduism - What Buddhist texts describe the doings of syncretized Hindu deities?,"
Malalasekera's Dictionary of Pali Proper Names is a great place to find this sort of information; for instance, the entry on Sakka has a whole list of sources for info on the entity, both canonical and commentarial. 
On the other hand, I can't think of any other divine beings that have been expropriated in the same way as Indra; in fact I'm not sure expropriation is the proper term, since Indra just means ""chief"", and so it could just be the Buddha using the Hindu name to describe Sakka.
Edit: Yama shows up in the Devaduta Sutta (MN 130)
"
