question,answer
Does something about DjVu prevent making a free viewer on iOS?,"In my opinion the relative inaccessibility of DjVu's libdjvu, including having their own bytestream compression contributed to the low acceptance of the DjVu format over the years and not patent issues. This hinders other software developers adapting their software to support DjVu and even more so 
when porting to a new platform. The DjVuLibre software has several characteristics that make it difficult to port. It is C++ based code that builds on a framework that seems to be generically usable, but is probably DjVuLibre specific. I conclude that on not having encountered the framework anywhere else, as well as specific names of classes, etc. that include the substring DJVU) in the framework. That framework, in the form of libdjvu, is however used in all of the DjVuLibre tools (bzz. djvu...) The libdjvu being a C++ library  makes it less portable and less accessible for being called from other languages (e.g. Python), than a C based library. To complicate things, the bytestreams in the DjVu file format are compressed using a Burrows Wheeler encoder. The encoder is similar to bzip2 but has its own, DjVu specific, implementation. This gives a small advantage over more standard compression schemes, but this is dwarfed by the conceptual better handling of compression of the images through the use of wavelet encoding and individually compressed layers. I analysed the DjVuLibre software some time ago, to extract OCR-ed text. I settled for a minimal Python implementation for that piece, as I could not get a Python program to hook up to the C++ libraries in a reasonable amount of time. I spent a few days getting the Python implementation to work, analysing the intransparent program flow of the library, all the while comparing the output with results from djvutxt and bzz. This resulted in the DJVU OCR extraction program included in Calibre. (The difficulties might be based on
my lack of programming experience: I have been programming C++ since the late 80's—one of the first commercial things I developed in C++  was a library  for creating GIF files in 1987—and have used Python since the mid 90's). I must say I really like the DjVu concepts, and love the superior quality/filesize ratio, compared to scans in other file formats I have used. I always scan to .DjVu. But although I primarily work on a Linux system, the scanning/conversion process includes commercial software running on a Windows box that gives me even better compression results than the open DjVuLibre library does (as well as OCR without an additional program)."
is there any software available to directly write in mobi format?,"Your question -- if I may restate -- is whether there are tools which allow you to create ebooks natively  for Kindle. Probably not, although it does have some specialized creation tools (Kindle Textbook Creator, > Kindle Kids' Book Creator, Kindle Comic Creator, Kindle Previewer).  My guess is that only Amazon.com could create such a tool because the .mobi standard is a proprietary format and is updated fairly regularly.  Some  tools have features  which let you export  to .mobi format (from MS word, PDF, or .mobi),  that includes Calibre  https://calibre-ebook.com/ Sigil, and Adobe InDesign. usually it converts from epub to mobi -- though calibre lets you convert from MS Word to mobi. But it isn't always a good conversion.  The thing is, aside from being a binary file, the Kindle format is trying to align closely to the epub format, so it makes sense (in my opinion) to focus on developing and testing an epub file -- and then after the fact converting the epub to mobi (and testing it and maybe  the styles so it works well on kindle devices and apps).  It's crazy and a waste of time to do all this; it would be a lot easier if Amazon.com  had adopted the epub standard. Certainly that would be better for publishers. But Amazon has come half-way and said if something is a valid EPUB file, then our Kindle Previewer app can reliably convert it to mobi. That's better than nothing.  For long term use, it's best to have an epub file -- because in the future it will be easier to convert from epub than to convert from .mobi"
is it allowed to print a freely available ebook for own usage,"The first point is that freely available does not mean freely
usable, not even freely redistributable.  Many copyrighted works are
freely available, even placed under a Creative common licence, but
still have legal restriction on their uses, regarding for example
modification or commercial use. The fact that it is, or is not
available in print or some other form is irrelevant. The only thing
that matters is what the licence says.  If you have no licence, then
every use is forbidden, unless explicitly permitted by local law,
though you are obviously permitted to read the document, as there
would be no point in making it available otherwise. However, the copyright law of some countries (France for example)
allow private copying, provided it is for your own use (which implies
that you do it yourself). There may be a further restriction that it
is legal only if your access to the source work is itself legal, thus
preventing copies from pirated sources. In your case, you have legal access to the document as it is freely
available. Hence, where law permits, you can make private copies on
whatever medium, including paper. However, using an online service to
get it printed would probably not be considered as doing it yourself.
Even going to a print-on-demand shop in the street might be legally
disputable. Then, things seldom get that formal, and it is likely that no one,
author included, will object, especially if the book is not available
for sale in the form you seek, so that you cannot possibly cause him
any damage. Further legal details (to add accuracy to previous answers) If you are in a country that is a member of the Bern Convention - which
is most countries, USA included - the work is protected by copyright
regardless of where it was created, and at least as well as work
created within the country. Actually, in the USA, copyright protection
is higher for unregistered foreign works than for unregistered US
works. In the USA, your legal risk in printing for your own use a book that
has not been registered with the Copyright Office is very low, since
the copyright owner cannot sue for attorney fees or punitive damage,
but only to get the price of the printed book. But I am not a lawyer."
eBook format in nowadays: EPUB is de facto standard?,"First, a note: I will not be considering PDFs in this answer, because I do not consider PDFs to be ebooks. There are a number of reasons for this, like lack of reflowability and end-user customization options, but the primary reason is that PDFs are not generally sold at sites that sell ebooks--you can't sell your PDFs through iBooks or the Kindle store or whatnot. Others have other opinions, and that's fine—the relevant info is that I won't be considering PDFs here. In terms of variety of devices supporting the format, epub is the clear standard—it's supported on nearly everything that reads ebooks. When you look at numbers, though, it's a different story: according to an article at Digital Book World, a recent Book Industry Study Group found the following statistics to the question ""Where do you typically acquire ebooks?"": This means that Amazon accounts for roughly 2/3 of the sales of ebooks, making their proprietary mobi/KF8 format the dominant format. In essence, there is no ""winner"" yet, and there is not likely to be any time soon. Apple, Google, Barnes & Noble, and Kobo are enough to ensure that epub will remain alive and kicking for quite some time. With a majority of the sales, Amazon has no impetus to switch to a standard, and they don't appear to be in any danger of losing much market share. Where we are is where we're likely to be for quite a while, which means making two formats: epub and mobi/KF8. fortunately, Amazon has gotten much better at making tools that convert from epub to their format, so concentrating on epub will give you something for Amazon as well with little extra work."
I have a book written in Word format [duplicate],"The accepted answer for the question How do I convert a Word document into an ebook? describes how to convert a book in .docx format to AZW3. As is very clear from the 3rd picture in that answer, where AZW3 is selected as output format, that there is a whole list of ""calibre output formats"". Searching the latter phrase should get you to the complete list of supported formats in the FAQ: 
AZW3, EPUB, FB2, OEB, LIT, LRF, MOBI, HTMLZ, PDB, PML, RB, PDF, RTF, SNB, TCR, TXT, TXTZ. From that list, someone can just select what they prefer for their device and/or software¹. For iPad users that depends on their software, but if that doesn't support AZW3 directly, it probably does support EPUB. Assuming you already can convert the .docx to AZW3, and since the capabilities of EPUB and AZW3 in formatting the eBook are very similar, selecting the conversion is the only thing you (or the owner of the iPad) needs to do. There is not going to be any additional considerations, beyond what you do for going from .docx to AZW3, on how to go about the conversion². ¹ One can argue that if the device/software does not support any of these formats, it should not be called an eBook reader.
² That should only be an a concern if the other output format allows for very little formatting control, like TXT"
Publishing blog posts as an ebook at Smashwords,"I can't speak for Smashwords, and this isn't legal advice, but I will say that none of the terms that you quote above seem to prohibit what you are describing.  I'm actually not sure what parts concern you. They require a complete work; that doesn't mean you have to publish a complete copy of a blog's archives. They seem to be worried mostly about books that end with an upsell, like ""Thanks for reading; to find out what happens to Joe and Susie, buy my other book for $99!"" None of the terms that you quoted prohibit publishing a book of material that you wrote that is available elsewhere. If the purpose of the blog posts selected for inclusion is advertising for your site, then 9b above is a problem. But if the posts are substantive in their own right, 9b doesn't indicate to me that you can never publish anything if it might interest the reader in other stuff that you've written. As for nonfiction, the Smashwords homepage has an entire category of nonfiction works. They clearly allow nonfiction as well as fiction. If you are concerned about it, you can always just email them and ask. If you are really concerned about it, get a California lawyer to review the terms and give you their thoughts (the terms are subject to California law, under paragraph 15b)."
"What does FlightCrew's ""Unable to find zip structure: End-of-central-directory"" mean?","That would mean your EPUB does not have a proper ZIP file structure.  You can try listing the content of your file with a normal zip unpacker, or test it with a real epubreader. If those do not complain, it could mean that FlightCrew has a bug."
"I have a dumb phone LG840G, is there an ebook reader available for it?","You should be able to use the browser or UC Browser/Opera Mini to read HTML files from an SD card, that is the best chance to get something usable. An alternative would be to render the ebook to PNG images and browse the image on the phone, but this takes much more memory. You can also open plain text files from your SD card using the build in File Browser and read them in the viewer (there might be limitations on the file size)."
How do I repack a .mobi file?,"KindleUnpack is primarily intended for debugging KindleGen issues. If your original Kindle books is an AZW3 book or a MOBI book generated with KindleGen, you can edit it with Calibre Editor.  Simply select the book in Calibre, right-click it and select Edit book. This will automatically unpack the book and open it in Calibre Editor. If you save the book it'll be automatically reassembled. "
Possible to transfer Adobe Digital Edition ePUB books from my local library to my Kindle?,"Your Kindle cannot handle .epub files. You could convert .epub to .mobi e.g. using Calibre, but this is only possible without DRM. There are also plugins to remove DRM, but using them is probably not legal in most jurisdictions."
Can you defragment a Kindle Paperwhite?,"To defragment a filesystem you need a software that does that. All you have to do to defragment the memory of your Kindle Paperwhite is to connect it to a PC/Mac and run a defragmentation utility on that drive. Edit: Being a flash drive though, as @Daniel suggests, it's actually not a good idea to defragment it, because there will not be any real benefit in terms of performance and actually doing it many times will shorten the life of the memory of your device. There is always something to learn out there!"
Could my eBook reader be infected by some sort of virus?,"As long as those readers don't provide the possibility to install third party software you should be quite safe.
As the main weakness of Android is the Enduser - installing bad applications containing malware and in the worst case viruses."
Is there a Linux distro geared to ebook users? [closed],"Greenie is an Lubuntu spin that works with standard Ubuntu repositories. It comes with a set of pre-installed apps for ebook readers and authors, including: The default language is Slovak, but experienced linux users will have no trouble installing Greenie and switching the installation and system language to English (or any other language).  Afte‌r installation, you will still need to use Keyboard Input Methods to switch the keyboard to your preferred language. I also had to add the Mozilla English add-on for browser spell-checking. Windows users can try a linux distro in a live session without changing their hard drive.  If you have never installed a linux distro before, you can find lots of answers at AskUbuntu that apply to any Ubuntu-based distro about how to burn an iso to disk or usb and how to do an installation. (But please note that Ubuntu-based installations such as Greenie are off-topic as such at AskUbuntu.) When you boot Greenie, the first option translates to Try Greenie without Installing, the second to Install Greenie. The easiest way to switch the language for experimenting with the live distro is to: This will drop you into the Try without Installing option, but with your preferred language as the system language.  You can then change the keyboard from Menu >> Preferences >> Keyboard Input Methods. (I have no connection to the Greenie project.)"
Where can I find Apple's iBooks formatting guide?,"Yes, you can get a PDF of the iBooks Asset Guide from their site: https://itunesconnect.apple.com/docs/iBooksAssetGuide5.1Revision2.pdf"
Are there any ebook libraries in the UK,"In the UK you can (I suspect it depends on the county/borough) borrow ebooks from your public library. They use Overdrive as I suspect many others do, so I think only do ePub readers(and only those that understand Adobe DRM), so no Kindles. Overdrive does do Kindles but only in the US. See the entry page and you can browse without registering for the London Borough of Croydon"
How do I remove a book from my Sony Reader?,"If you want to remove files from the PRS-T1 you can connect the reader via its USB cable to a computer and have the internal memory available as a USB drive. The TRS-1 shows itself as two USB devices, one named SETTINGS, the other READER.
The books are normally under READER/BOOKS. You can just search for, and delete the books with your OS' file browser.  The device will rebuild the database of available books after disconnecting it from the computer.
Make sure to properly remove the device, do not just unplug it."
What software is used by the publishing companies to create diagrams in the introductory physics textbooks?,"They are almost certainly done in TeX/LaTeX. TeX/LaTeX is not about ""less effort"", but exactness. It is a programming language for typesetting with a special emphasis on math and equations. TeX has a long history with the academic community in publishing. Explaining TeX and LaTeX is outside the scope of this forum (There is a TeX.stackexchange.com site). You can find some examples of how those types of diagrams are done here: http://www.texample.net/tikz/examples/tag/diagrams/ "
Will I be able to read PDFs in Cyrillic on Kindle (classic)?,"Yes, Kindle (classic) has no problem with displaying Cyrillic characters in PDFs.  Here is the proof: "
How are Kindle standard pages calculated?,"There is a plugin for Calibre called Count Pages. It can estimate page and word counts for a given ebook, using various algorithms, and one of them is an APNX estimation based on Amazon Kindle. You can try to use it and perform your own tests; if you have a decent amount of books, once it has counted the total words of each one and estimated the page numbers, you can do your math and calculate the average words per page."
How do I wipe clean kindle e-reader?,"To factory reset your Kindle to wipe it clean of data: From Home, tap the Menu (three dots) icon, and then tap Settings.
Tap the Device Options, and then tap Reset Device. Your Kindle will restart."
Are book trailers necessary?,"By itself I don't think book trailers accomplish very much; they have to be coordinated with other publicity/marketing methods. On the other hand, Amazon and Smashwords allow book trailers (with Amazon, you have to create an account on Author Central). So it gives potential readers a different kind of medium which can justify the purchase decision.  I have created one book trailer and am working on another. I have also studied other book trailers and have reached the conclusion that lowtech works best. Many of the book trailers seem way too polished and marketing-ish to convince me of anything. On the other hand, I have seen some book trailers in sci fi genre which definitely made the book more appealing to me. But sci fi is a special category, and the graphics/presentation for these book trailers were top-notch -- and expensive if you had to pay someone to do it.  In my opinion, book trailers are fairly good at building an author brand. You could just have a 2-3 minute video of the author speaking about why he/she wrote the book. If the book is nonfiction, the author could talk about what led him or her to write the book (that is always interesting). Keep in mind that viewers tend to judge authors by appearances or  manner of talk or dress.  Some degree of mystery can be good for an author.  Update: I just checked the youtube page for my 1st book trailer, and I see that in 2 years the video received 164 views. That's not a lot of payoff; on the other hand, a lot of self-help, business gurus do youtube videos to accompany their book and get a good number of hits -- especially if they are peddling practical knowledge. "
Is there a way to share my Amazon eBook collection with other family members?,"You can lend Kindle books to others through the Kindle store: https://www.amazon.com/gp/help/customer/display.html/ref=hp_rel_topic?ie=UTF8&nodeId=200549320 ""A Kindle book can only be loaned one time"" and loans are limited to 14 days."
Can Amazon know about the books I upload to my Kindle device?,"While it is possible, it is improbable as long as you ensure all data capabilities of the device are always off. If they are ever turned on, there would be nothing stopping Amazon from snooping what's on your device. Furthermore, if it's 3G enabled, you have no guarantee that it doesn't switch on data without your knowledge and snoops your files. "
Installing own font & using it to read ebook,"Kobo ereaders are known for their font customization capabilities. They have a dozen of preinstalled fonts, and a couple of them aimed exactly to dyslexic readers.
Besides selecting the font, you can also tweak it to your needs with many options for dimensions, spacing, margins, justification and thickness. You can read a couple of reviews, here and here, that explain these features with pictures so you can see if this is what you need. On Kobo ereaders it is also easy to add custom fonts, we already have a question on this site that explain how to do it."
Can an ePub 2.0 contain multiple .opf files?,"I am not sure what your two .opf files contain, but the EPUB 2.0.1 specs http://www.idpf.org/doc_library/epub/OCF_2.0.1_draft.doc (section 10.1) say: The <rootfiles> element MUST contain at least one  element
  that has a media-type of “application/oebps-package+xml”. Only one
   element with a media-type of
  “application/oebps-package+xml” SHOULD be included. The file
  referenced by the first  element that has a media-type of
  “application/oebps-package+xml” will be considered the EPUB rootfile. 
  The EPUB rootfile (the OPF package file) MUST NOT be encrypted. This means that you can have more OPF files in the container, and even reference them in the container.xml, but only the first will be considered the primary one. (And, I add, most real world reading systems will ignore the others.) Note, however, that you can have multiple renditions inside the EPUB container: So, just having another OPF file is fine, as long as you list it in the <manifest> (of the OPF actually referenced in the container.xml). For any functional purpose, it will be ignored by the reading system. Comment 1: I still think that the EPUB you have been given is probably the result of some sort of experimentation, and having two OPF files is the result of some mistake. Comment 2: in theory, having multiple OPF files is a way to pack multiple renditions of the same publication inside the same EPUB container. The IDPF has a working group on multiple renditions: http://www.idpf.org/epub/renditions/multiple/"
Finding the home screen's most recent books on Linux,Use the following shell command for listing the last three files: For putting a book at the top of the list use touch:
"Legality of read-it-later services, most specifically Send to Kindle","If you use the ""Send to Kindle"" program/browser extension, you have already accessed the content from the remote website. You are simply sending the (already downloaded to your PC) data to Amazon, to have it available on your Kindle devices. The Terms of Service are here: http://www.amazon.com/gp/help/customer/display.html/ref=hp_bc_nav?ie=UTF8&nodeId=201238330 A different legal scenario is when a site owner incorporates the ""Send to Kindle"" button in her or his Web site. In that case, they accept these ToS: http://www.amazon.com/gp/help/customer/display.html?&nodeId=201139380?ref_=stk_wdg Other similar services like Pocket have similar ToS."
