question,answer
How do I prevent Calibre from modifying EPUB files when I read them?,"I hadn't looked before so I did a little investigating. With Calibre 4.23 on Linux, I found that it's not exactly Calibre, it's the Reader. I don't know why this Reader (it's a newly re-written reader, but I don't know if the old one did this) is modifying the epub meta-data. There is no reason to do so that I'm aware of as bookmarks and other reading information is kept in the database. With that in mind, I changed the EPUB file permission to remove write permission. As a Read-Only file, everything seems to continue working normally and the Reader is no longer capable of changing it. So at this point I can only suggest: I did a little more investigation and found that ""ebook-viewer"" is writing meta-data under ""Miscellaneous"" ""calibre_bookmarks.txt"" even though bookmarks are controlled via the database. Deleting this entire entry via ""edit book"" has no effect and the book marks are still present because they are in the DB. The content written also includes: access time stamps, Book Title, and my User ID. It's written as JSON Base64. This should not be happening! I posted Bug #1894442 Calibre says it's not a bug because most users prefer it this way. Nevertheless, it can be turned off by: LTrun {sic} it off under the miscellaneous section of the viewer
preferences. I verified that it worked (at least for one in a row). Apparently the checkbox to disable directly annotating the ebook file was removed in recent updates. I don't know why they are working so hard to force a hidden write function into a READER. However only the GUI presentation was removed, the actual option still exists, at least as of the current 6.19.1. In the file .config/calibre/viewer-webengine.json an entry of: will still disable directly annotating the ebook file. If the entry is missing, Calibre defaults to true."
Is there any e-ink technology that can display colors?,"E-ink have had their Triton technology for a few years, which has been available in several commercial products: Hanvon color eReader, JetBook Color and PocketBook Color Lux. I cannot find the reference, but IIRC there are multiple layers through which the light needs to reflect. Therefore the lighting conditions need to be better than for monochrome eInk displays."
How to convert PDFs to readable Kindle format,"Simplest way is to send kindle team an email with the PDF attached along. They'll send you back the converted .mobi format. Send to Kindle by E-mail Send documents to your Kindle as an email
  attachment You and your approved contacts can send documents to your
  registered Kindle devices, free Kindle reading applications, and your
  Kindle Library in the Amazon Cloud by e-mailing them to your
  Send-to-Kindle e-mail address ([name]@kindle.com). Your Send-to-Kindle
  e-mail address is a unique e-mail address assigned to each of your
  Kindle devices and free Kindle reading applications upon registration. How to send a document to your Kindle: To find your Send-to-Kindle
  e-mail address, visit the Manage your Devices page at Manage Your
  Kindle. Documents can only be sent to your Kindle devices or apps from
  e-mail accounts that you added to your Approved Personal Document
  E-mail List. To add an e-mail account, visit the Personal Document
  Settings page at Manage Your Kindle. To send a document to your Kindle
  device or app, simply attach it to an e-mail addressed to your
  Send-to-Kindle e-mail. It is not necessary to include a subject in the
  email."
Are there any ebook libraries in Germany,"Most libraries in Germany are in my opinion joined with Onleihe. They have a website where you can see which library is connected by clicking on a map to select your Bundesland (Hessen, Bayern, etc.) http://www.onleihe.net/ihre-onleihe-finden/onleihen-in-deutschland.html"
How can I reset the reading speed data on a Kindle?,"According to a Kindle forum thread the command to reset this data is: On a touchscreen Kindle, tap the top of the screen to bring up the search box.  After you type the command and get no results, return to the book.  The status line will show Learning reading speed...  Since the search string is saved, you won't have to laboriously type the command again in order to reset again.  That ought to make testing a lot easier."
Ebooks file naming scheme -- Books in a series,"If you are using Calibre, its database is already set to have each piece of information about a book in its proper field (i.e., there will be a field for the title, another for the author, another one for the series and series numbering, and so on), but I'm sure that you already know this. So, within Calibre, you don't need (and you are not supposed) to change the title by including the series information; you can let Calibre rename those files on-the-fly when you export them to a given ereader by using its tool called Plugboard, that relies on the calibre template language. Here is, in short, the recipe to use, pasted from MobileRead forums: I have been playing around with the Metadata plugboards to get the
  titles on a Kindle 3 to show series information. I used the following
  template:  format: mobi
  device: kindle2
  template: {series}{series_index:0>2s| - | - }{title}
  destination: title This works very nicely for books that are part of a series e.g.:   A Song of Ice & Fire - 01 - A Game of Thrones
  A Song of Ice & Fire - 02 - A Clash of Kings
  A Song of Ice & Fire - 03 - A Storm of Swords
  A Song of Ice & Fire - 04 - A Feast for Crows   The process is very easy to do but if you are not used to its workings it is a bit long to explain, so I'm linking some of articles that show you step by step how to do it."
Are ebooks licensed only to a certain email address?,"I do disagree with idiotprogrammer's answer because this question does dive into DRM which plays a large part in ebooks. You could try changing the authorization of your Adobe Digital Editions account, reference: ""How do I change the authorization on my laptop"" with a re-install. If that doesn't work you would need to contact ebooks.com. Since you're getting a .acsm file I would 99% think they are using Adobe Content Server.   First, it's ridiculous to think that a DRMed ebook is tied to an
  email. Instead, it is tied to a user account created for a specific
  vendor. Every website under the sun allows you to change the email for
  the account. Even if the sign on you use is the email I suspect you
  will be able to change the email associated with it from account
  management on the user's site. Actually not..  ebooks.com might treat the email address as the ID and use it for validation to prevent transfer. Your issue will need to be addressed at the vendor if a re-install of ADE is unsuccessful.  To my recollection DRM is scoped to what they have identified as the ID.  In this case your ID is your email address.  You might be allowed to change your email address in the account settings of ebooks.com but I do not have an account there so I wouldn't know. I did run across this in research: ""I figured out the .acsm problem!""."
Is it a good idea to minify code when coding ePubs?,"Personally, I never minify code in ebooks. A big part of the reason for that is that unlike many here, I don't use Sigil or Calibre to edit my epub files—I use either Notepad++ or Geany depending on the OS I'm working in. Because I'm always working with the code, it does nothing but make my life harder if I've minified the whole thing and the client comes back to us with two or three rounds of proofing corrections. On top of that, many in the publishing world are starting to talk about using HTML5 as a base format for all their books. Since epub 3.0 content files are HTML 5, you're pretty much working directly with the source files when you're working with the epub, and the source files should be human-readable so that any problems that come up with them can be easily fixed. Finally, the point of minifying code is to let files transfer across networks more quickly, which is a non-issue for ebooks where everything is local."
Can I donate an ebook to my library's Overdrive collection?,"No.  If your library uses overdrive you can not give them ebooks to be loaned via Overdrive.  According to the Overdrive FAQ only titles purchased from overdrive are available for library loans. Can I add the titles I purchased from another vendor to my OverDrive collection? Only titles purchased from OverDrive are licensed to be included in your OverDrive collection. You may upload proprietary content (e.g., lesson plans, podcasts, audio or video recordings, etc.) to your collection. Overdrive is a subscription based service.  Each library creates it's own  custom digital collection, which is managed by the library staff.  Overdrive does not offer any services directly to library patrons so purchasing on behalf of the library is not an option. You would need to contact your local library, you may be able to make a direct monetary donation in combination with a request to include a title in your library's collection. Does my digital library allow patrons to access OverDrive’s entire catalog of titles? OverDrive allows your library to create its own custom digital collection. Your team will be able to browse OverDrive’s extensive catalog of eBooks, audiobooks, music, and video and select titles based on your library’s collection development goals. Patrons will also have the opportunity to “recommend to library” the titles they would like to read that the library has not yet purchased. Ability to recommend titles varies by geographical location."
Syncing kindle book annotations (non Amazon books) across kindle apps,"Here is my chat: ► Amazon: I'm sorry, currently there is no option to see the highlights made in the personal documents. ► Me: Ok, you are saying that Amazon deleted the website that allowed viewing highlights made in personal documents. Then I still have the other 2 questions:
1) Should Whispersync work to keep my reading ""location"" up to date between devices when reading personal documents (or is that not supported anymore either)? 2) Should Whispersync work to keep my highlights identical between devices when reading personal documents (or is that not supported anymore either)? ► Amazon: I can understand your concern. Please allow me a moment to check this.
Thanks for waiting.
I'm sorry, the highlights will not sync through all the devices which are made on personal documents. ► Me: And I guess the current reading ""location"" / progress won't either? ► Amazon: Yes, exactly."
How to remove white margins from ePub in Google Play Books,"You can use Sigil to change the margins and border by changing the style file. 
If you have many files to change, you might be better of using Calibre's EPUB to EPUB conversion and setting the margins for the output file to your liking. If you don't have access to these tools and know about CSS, you can also unzip the EPUB files, change the style sheet by hand and rezip the files back into an EPUB. (This sounds more complicated than it is.)"
How can I read notes alongside with text in Kindle readers?,"The short answer is no. The only way to make notes easier to read is to find a book that has been properly formatted to have hyperlinked inline notes. If a book doesn't have that, then you could either request it from the publisher or fix it yourself."
"When an Amazon account contains more than 1023 purchased Kindle books, how do you access the books beyond the 1023rd book?","This sounds like a limitation of the software, so you probably won't be able to get around it from the device. First, I recommend reporting this as a bug to Amazon. Don't expect them to fix it right away or anything, but it's always good to let the devs know when something doesn't behave as you as a user want. ;) If your final goal is to get all your books to the Kindle somehow, the solution would be to download them from Amazon (""Your Content and Devices"") and sideload them over the USB cable. (It's good to download the files as backups anyway and de-DRM them while you do that, IMO, but that's a different topic...) EDIT - how to report a bug: I forgot that Amazon is one of those ""don't bother us dirty mortal!"" companies. The only way to report a Kindle bug I found is to use the form at /gp/help/support/contact-us (choose ""Devices"" from the buttons above) - and whow, that is one very well-buried page!"
Are there any solutions available for managing a corporate library of ebooks?,"There aren’t many choices. The most simple is to have a cloud-like space/service or simply a shared intranet directory. The need for controlling readers requires much more and is typically dependent on a special app or DRM. This issue is typically a thing for bigger companies like publishers or libraries (Adobe Content Server, Azardi Online). If it is simple, small library it would need simple and strict rules. Otherwise the solution would be expensive, complex and annoying for you. You could also try: Personal Book Space but I have no experiences with it."
How do I modify the connection habits of my Kindle Keyboard 3G?,"I've looked into this since you posted this and it's just not possible. Well, if you want to completely replace the existing OS and software, you could, but that doesn't really address your use case."
"How does the kindle define how many ""book size dots"" to display?","it is accurate. i found at least 10 sizes for 15 plain text book's (azw3 with no  pictures or complicating formatting), according to there reading time. ""approximation of how long the book is."" means: how big is the file. not how many syllables characters or words there are (that's why it says ""approximation""). book's with pictures charts or other formatting, or PDF's will have more dots."
How to sync my Kindle with my Kindle library without using WiFi?,"Using Calibre you could try : Of course this requires some initial configuration (telling Calibre how to send email, ...) and I can not guarantee it will work having no 3G Kindle to test it myself. But it seems to be worth a try as it would most likely make sure that the file that gets copied on your kindle has the right format/information to be identified correctly."
Can you use a Kindle without an Amazon account?,"I just got a new paperwhite, and am reading my own books on it without registering. It nags you to register, but if you open Calibre, and then connect via USB, you can put books on, and it all works just as normal. The only thing you can't do if you don't register is to ""buy"" Amazon's drm books, or access the ones you've already ""bought.""  Although it is possible you may be able to transfer said books through your kindle desktop app, I haven't tried,don't really care. "
"Can I copy or publish, text from a website.","I am not a lawyer, but: If the text is in the public domain, then yes, you can use it. Be sure that it really is in the public domain, though—copyright lasts for a very long time. Also bear in mind that if the text is annotated, translated, or altered in any other way, or if it's a collection of public domain works, there may be further complications. If you have any doubts, you'd be best advised to contact an IP/Copyright lawyer."
High resolution small-size pdf,"The size of a PDF file is dependent on the content of that file. A PDF file is a bundle of streams, with mostly compressed data. If you generate a PDF file from e.g. a Word or OpenOffice document, these file tend to be relatively small, especially if you do not include Font information and rely on the system provided fonts or font substitutions.
Adding images to your text will make the files much larger. Since PDF is one of the minority of image file formats that support multiple images, it is often (mis-)used to store multiple images, that e.g. come from a scan. Those scans are often already compressed JPEG images and for those the PDF file works only as a container (no, or little further compression  is possible). For those kinds of PDF files, the size can be very large, depending on the pixel size of the images (scan resolution x paper format) and in case of lossy compression (JPEG) the quality of the compression.  If you extract such lossy image files to a lossless format like PNG immediately blows up each of the images often by an order of magnitude. So your results are not surprising.  It would be much better to just extract the individual pages of the file into separate PDF files and recombine only the pages that you need. This can be done without  having to decompress the streams containing the imagery e.g. by a program like pdftk. If you pick half of the pages of a book, you can expect to have halve the size document in the end (on average)."
Connect Kobo Touch to Linux PC using USB; PC not recognized by reader,"Exactly  the same problem.
Fedora 24, Kobo mini connected via micro USB cable Kobo starts charging but no sign of it on computer, no ""connect"" option 
on kobo. Tried a different cable and hey presto - instant success... Sadly, I've seen this behaviour before, hence trying a different cable 
was my first thing to try (after checking internet and finding no real 
answers but coming across your question... ) Motto is - not all cables are equal in all situations...  Hope this helps"
Under what conditions should I apply for ISBN numbers for digital works?,Note the following - Source: http://www.sellbox.com/isbn-essentials-an-faq-for-ebook-publishers/ & Internet
When it is better to use plain HTML instead of CSS?,"In general, formatting with HTML (though regarded as outdated by many, including W3C) tends to work more reliably than formatting with CSS. Support to CSS varies and can be disabled (though this is rare and mainly applies to web browsers). However, HTML formatting is very limited. You can use <i> for italic, <sup> for superscript, and a little else, but you cannot e.g. specify the size or vertical position of superscripts (which depend on user agent and vary considerably). In e-books, however, we can expect CSS work well for the simple formatting that would be possible in CSS, too. I tested your example, with an ebook created with Sigil and then converted to .mobi format with Calibre, and viewed with Kindle for PC, the exponents worked OK, the same way with HTML only, when I used the obvious CSS rules So if the exponents didn’t work, probably either the e-book is missing a CSS rule that makes .apicecorsivo appear as a superscript, or that rule was somehow lost when generating the .mobi version. For stylistic reasons, it is best to avoid mixing HTML and CSS formatting so that e.g. some exponents are marked with <sup>, some just styled with CSS (set on <span> elements for example). The reason is that generally you cannot guarantee that the style applied is really the same. Your example has <span class=""apicecorsivo"">n</span><sup>-1</sup>, which is meant to produce “n−1” as superscript, but it may happen that they will be differently subscripted, i.e. in different font size or in different vertical position. There are considerable styling problems with <sup> in web browsers; they tend to produce uneven line spacing as well as qualitatively questionable superscripts. Such issues might not be that relevant in e-book readers, but it might still be safest to use a combined strategy, using <i> for italic (it’s rather safe) but CSS for superscripting. This would mean, in the example case, HTML markup like with CSS like"
Can I change the cover of a mobi/epub book?,"Yes we can do that using opensource software like Calibre. The cover will be updated in your Kindle device. If its not updated try restarting the device. It will work after some time. The steps for epub files are similar, you will just need to copy the file to a different directory. (There are other programs like Cigil to edit epub files but Calibre can be used for both formats.)"
How do I add a cover (and other pictures) to my ePub?,"Images in general should be added just as they would be in HTML, with an <img> tag. The image files themselves should then be included in the OEBPS folder or a subfolder (I generally use a subfolder, personally). Each image file will need to be declared in the <manifest> section of the content.opf file. As mentioned in the epub 3.0 specifications, the cover image in particular should also have the cover-image property assigned to it in the <manifest>, like so: The <manifest> entry for non-cover images is the same, just without the properties=""cover-image"" bit. That's it for plain epub, but some retailers will also ask for a <meta> element in the <metadata> section of the content.opf file declaring the cover, like so (from Amazon's Kindle Publishing Guidelines): Note that Amazon in particular no longer requires the <meta> bit as long as the properties=""cover-image"" is correctly declared."
Convert Blog to book,"I used to convert web pages to PDF, but on the Kindle it is much nicer to read mobi documents. To convert web pages to mobi, I highly recommend the GrabMyBooks firefox extension. It is the one piece of software that has dramatically improved my experience on my Kindle this year (and I already use great software such as Briss, Librerator and Kranf's Kindle Collection Manager). GrabMyBooks lets you gradually build an ebook in a separate Firefox tab by selecting web pages or content as you go. You can add pages one by one by right-clicking on the page and selecting ""Grab this Page"". If you only want part of a page, you can also select text and grab it. And you can also select multiple links and grab them, which is very convenient if you are interested in multiple blog posts. Usually, when you grab a web page for your ebook, there are many components of the page you do not want: the sidebars, the comments and so on. GrabMyBooks is pretty good at guessing which content you want, but it sometimes gets it wrong. In these cases, it's very useful to be able to select the text you want, right-click and choose ""Grab selected text"". By default, GrabMyBooks creates an Epub. But in the Settings, you can tell it to create a mobi file. For GrabMyBooks to create mobi files, you must have Calibre installed. You then tell GrabMyBooks where Calibre is installed. This may sound like a lot of work, but configuring GrabMyBooks properly is well worth it if you want a luxury experience of creating ebooks from web content on the fly. For instance, there is a setting where you specify the default save directory. Well, I have it save my ebooks directly to my Kindle's ""documents"" folder. Also, there is an option where GrabMyBooks saves an Epub file in addition to the mobi file. This allows you to later load the Epub book in GrabMyBooks and edit it again, adding or deleting web pages. In the settings, you can set a directory where the software will save Epubs, since your default format will be mobi.  I recommend always editing the Metadata setting before grabbing your book so that it displays with a nice title and author name. Hope you like it as much as I do."
EPUB 3.0 <dc:identifier>,"The dc:identifier is commonly an ISBN, though any sort of URN will do. Further information about using  in epub can be found on the IDPF's site, but as a quick example, you could use something like: As long as the identifier is unique, it should be fine. At the above link, the IDPF says: Every metadata section must include at least one identifier element
  containing an unambiguous identifier for the Publication. Multiple
  identifier elements are permitted, but only one can be marked as the
  Unique Identifier via the package element unique-identifier attribute."
What is the formula for converting a 10 digit ISBN to a 13 digit ISBN?,"Wikipedia gives it as The check digit is calculated as per Wikipedia This is the result as a number between 1 and 10, unless the figure is 10 then the result is 0 x_13 = (10 - (x_1 + 3x_2 + x_3 + 3x_4 + ... + x_11 + 3x_12) mod10 ) mod 10 "
Is it advisable to add sound excerpts to an ebook?,"It's great to hear about a project where the audio would actually add substantively to the content of the book--that's too often not the case. In your case, I'd say yes, it does definitely make sense to add the audio, as it is directly relevant and helpful to understanding the subject. It is also perfectly allowable in the epub 3.0 specification, though support is optional rather than mandatory--not all reading systems will have support, but there is a standardized method for those that do support it. Outside of the epub world, things are a little less rosy: Amazon sells files with audio built in, but only supports multimedia on their iOS apps. In addition, last I checked they weren't accepting multimedia-enabled files through KDP (their self-publishing program), even though the instructions for making such files are clearly available in the Kindle Publishing Guidelines. In order to sell a multimedia file through Amazon, you'll need to be able to talk directly to Amazon--if you're a mid size or larger publisher, you probably have a contact you can speak with about that."
How can I optimize an epub file?,"Limiting compatibility issues Making it faster to load Keeping it consistent Keep the visual look as simple as possible; if you want to include some fancy layout (i.e. for chapter titles or other particular portions of text like quotes and so on) try to define it as properly and accurately as possible with CSS styles, and test the outcome with the greater number of reading devices and software that you can. If you want to use any specific font, be sure to include it in the epub file and to define its @font-face and styles in the CSS file."
