question,answer
Convert PNG to DJVU,"PNG and DjVu are complementary formats as PNG is lossless and DjVu is lossy. DjVu's effectiveness in storing information is the result of using high quality compression and splitting a single image into multiple layers which essentially employ different compression algorithms. As you indicate, you already know how to convert JPEG or PPM to DjVu, so the simple answer is convert your PNG to either JPEG or PPM and use that as an input for you known conversion. These can be considered different routes to obtaining a DjVu file because they store data in different layers, and they don't generate the same output (in quality and compression). Hazzit's answer is correct for monochrome images, as it first converts the PNG to a bitonal (black & white) image that is then, using cjb2, stored in the bitonal layer of a DjVu file. With the --clean option cjb2 does only minimal lossy compression, but if you start out with a multicolor PNG (such as a photo), you will have lost most of the information in the conversion to a bitonal image. Low color PNG images can be converted first to .ppm (you can do this with the ImageMagick as in Hazzit's answer as well by specifying a .ppm output file name instead of a .pbm) and then use cpaldjvu. This program does simple quantization, and stores this information into multiple layers. If your PNG has many colors (like in a photo) you will have better results converting the PNG file to JPEG (again with convert and a .jpg output file) and then use that to convert to DjVu. You can e.g. print/convert the PNG to PostScript and use that as input to pdf2djvu that is part of DjVuLibre. The resulting image data is compressed using Wavelet compression and stored in a different layer from the bitonal one mentioned in the previous example. What route to take depends on the contents of the input file format and the required result, far more than it does on being a PNG file. Especially with the DjVuLibre tools no boilerplate answer can be given, as they do not help you determine what compression is best for the image you provide. You implicitly do that by selecting the conversion program (cjb2, cpaldjvu etc). In my experience the DjVuLibre—as a reference implementation—generates correct DjVu files, but it doesn't employ the best compression techniques to generate the output. You might want to look at a  converter that is not based on DjVuLibre, if resulting compression ratio and/or image quality is important. You can use any2djvu to do an online conversion, or one of the other online conversion tools. They do a better analysis of the images to determine what is the best way to compress your image (i.e. what goes in what layer). You can freely experiment with those, but of course you don't know what happens with your data. The commercial Document Express Editor also does a better job, (originally from LizardTech, who also released the DjVuLibre as open source), which was for some time available from Caminova and now possible from Cuminas "
What is the easiest workflow to publish ePub files from highly structured database content?,"I have done projects like this. I am assuming that you know how to select the data you need from your database. I would suggest you develop a template based on pandoc's extended markdown (to get the cross-referencing), merge the data with the template and then script pandoc to convert that to EPUB2 and PDF. If you want to offer a Kindle-compatible ebook (and you are giving it away), you could then script Kindlegen (available from Amazon) to turn the EPUB2 into a MOBI file. This isn't a trivial undertaking, but it should be doable."
Is the file size limit for Nook epub files still 600MB?,"I appears that the limit is now 20MB Your manuscript file must be less than 20MB in size and in one of the
  following formats: .doc, .docx, .txt, .rtf, .htm, .html, or .epub.
  Many manuscript files that are larger than 20 megabytes don't need to
  be.  If your manuscript file is larger than 20MB, try reducing the
  image size, decreasing the dots per inch (dpi), and/or increasing the
  JPEG compression on the images in your eBook.  After applying JPEG
  compression to the images, you should be able to get the individual
  image files under 100 kilobytes each. See also The Nook Press Publishing FAQ"
This title is not currently available for purchase?,"It looks like this is an Amazon based issue. This book is currently unavailable because there is an issue with its description, content, or formatting. We are working with the publisher to fix the issue. As always, we value customer feedback. Note that is book is avaiable at Wikisource & PG "
How widely used is Social DRM?,"Most of my experience with social DRM has been through smaller tech publishers like The Pragmatic Bookshelf, where they embed the purchaser's name into the title of the book, like <dc:title>Programming Ruby 1.9 &amp; 2.0 (for [name])</dc:title>. Probably the biggest titles to use social DRM, though, are the Harry Potter books through Pottermore. Here's a link to an article that goes into detail about it: http://copyrightandtechnology.com/2012/04/08/the-harry-potter-watermarking-experiment/ and a relevant chunk: The EPUB version that I downloaded is not DRM-protected; instead it
  contains two things: “This book is watermarked and was acquired by
  user ec107c00b9577436d6354e54cd9da5c9 on 31 March 2012″ on the
  copyright page, and various bits of data inserted invisibly into
  images and other places inside the book. As far as pros and cons of social DRM vs. more traditional DRM: there's lots of info out there that suggests that DRM in general is not terribly useful, but there are strong feelings on both sides of the issue. I'd suggest checking out what tech publisher Tim O'Reilly has to say: http://www.forbes.com/forbes/2011/0411/focus-tim-oreilly-media-e-book-antipiracy-steal-this.html."
Can Kindle's dictionary be disabled?,"I think the only option you have is to delete the dictionary completely, thus disabling it. (Search for the dictionary on your device and remove it like any other book. You can re-download it later if there is the need.)"
How do I override the power cycling when the battery gets below 5%?,Unfortunately this is not possible. The exact explanation for this actually comes from Android. Buried deep within the Android source code is this little gem: BatteryService.java:239 This basically forces the system to shutdown if the battery level reaches 0%. The isPoweredLocked function determines whether any of the following are true: It should also be noted (as Jason mentioned in his comment) that lithium-ion batteries typically power off when they reach a predetermined low voltage to prevent further discharge and consequent damage.
Share book uploaded to my Google Play Books account with other account,"As long as you uploaded that specific book to google play books (in contrast to buying it on that platform) you can simply download it as a epub/pdf file using Adobe Digital Editions.
A detailed tutorial on this procedure can be found at Google Play Help."
"Is there a way to publish an eBook, distribute it and the push updates to the distributed eBooks?","Most online publishers have a method to allow for updates to published ebooks. The user generally is given way to identify that a book has an update, then the user is given the option to re-download the work.  I don't think any publisher has ""push"" to reader.   So yes there is way to redistribute the book, but it is dependent on user to perform some action to receive the update."
Is it more difficult to sideload books on to a Kindle Fire than other devices?,"The Kindle Fire is not difficult to sideload to--at any rate, the 1st generation version that I have is trivially easy: just plug the Fire into the computer with a micro USB cable, it shows up as a drive, and drag .mobi files into the relevant folder on the Fire. Easy!"
Internet access on the 3G Amazon Kindles?,"I have various Kindles including: 
My Kindle Fire first model, second edition, WiFi - it can access any web site over wifi
My Kindle 4 WiFi and Kindle 5 WiFi can also access any site over wifi My Kindle Paperwhite 3G can access Wikipedia.com over 3G. It asks for a WiFi connection to visit sites such as google.com This concurs with Nathan Osman's comment on your question.  So in answer to your question, all the kindle models I have include a web browser. They can access most sites using WiFi, however the newer 3G models are restricted to wikipedia and amazon by Amazon. PS: Even on the older Kindle Keyboard 3G models I found they sometimes asked for WiFi when I tried to visit sites after a while. However if I first visited the Amazon store then the 3G connection worked correctly for other web sites. I tried this approach on the Paperwhite 3G however I was still asked for a WiFi connection when visiting sites such as Google so there seems to be a policy-based restriction on newer models (possibly to save Amazon from data charges?)"
How to change the images displayed when my Kindle Touch is put to sleep?,"This is possible. However, you must jailbreak your Kindle first. Basically you:"
Calibre ebook viewer - Apply User Stylesheet to Full Screen Mode,"Paste the following in the 'User stylesheet', click ok. Then go to 'Theming' and save the style with whatever name you like. The e-book will display nicely in any screen mode and there are a couple of neat little extras you won't see with other user themes. As with all CSS it can be further altered and tweaked to suit."
How do I make the images larger for Paperwhite?,"I can only speak generally about how images are converted in Kindle. I have not used MS Word to do it (I make my ebooks in HTML), but I have lots of insights about images in kindle and have done a lot of testing.   Kindlegen will autoconvert images to the size/resolution appropriate for the device. BUT you need to make sure you start with a source image which is high resolution enough for it to be resized.  I realize that the HTML --> EPUB --> MOBI might be different from MSWORD --> MOBI, but according to the Amazon Kindle Publishing Guidelines PDF they should be 300 dpi, RGB and should be able to display at 2x magnification across devices. Therefore, you really need to have the width be at least 1600 or 3200pixels at 300 dpi.  I suspect that the source image you used was a crappy web image at 72dpi, and then even though you think it's resizing to acceptable quality levels, the low resolution computer monitor is not showing what it really looks like. That's why it looks small. I'm guessing that the  cloud previewer sees that it's a low quality image and it keeping it small because that will prevent pixilated rendering of images on some of its devices.  You don't need to have graphics good enough to print, but it needs to be significantly better than a 72 dpi web graphic.  (I Have cheated one time and increased a 300 dpi 600px wide graphic by opening it up in a separate graphics program and scaling it up to 1600, but that was a special case; the image detail was dense enough that it could be expanded without losing quality).  MS WOrd may not let you see properties of images. If so, You may need to remove it from MS Word and then edit it in a graphics editor (which allows you to bump up the dpi and scale the resolution up) I would guess that you need an image width 1600px at 300 dpi.  Part of the problem is that the MS WORD to MOBI method does not give you much freedom to tweak it. Amazon's instructions for these conversions are fairly superficial and lead to such issues as you have.  From the standpoint of production, you might want to consider using Calibre (free software) to do conversions from MS Word to .mobi and then open things up in the Kindle Beta Previewer 3
http://www.amazon.com/gp/feature.html/?docId=1003018611 You're viewing the alleged ebook  in the cloud viewer. It's unlikely that what you are seeing in cloud viewer bears any resemblance to what you might see on a Kindle e-ink or Kindle tablet (especially on images).  I do things in HTML/EPUB, and I spend most of my time trying to troubleshoot Kindle's use of images. It's hard -- especially because things might look fine on one device and crappy on another. (Kindle for IOS is its separate kind of hell).  I test ebook images on  all my kindle files on Kindle previewer, Kindle app for Android, Kindle e-ink device and Kindle app for ios. (I don't have access to a kindle device -- though I have good reason to believe that Kindle app for android renders things similar to Kindle devices).  The key thing (to summarize) is to make the graphic as high quality as possible. "
"Epub -> Mobi/Azw3 conversion (calibre) , Kindle App doesn't show cover no matter what","Everything works fine except the book covers don't show up in kindle app.  Unfortunately, that's the default behavior, because the Kindle for PC/OSX app will only display covers for ""personal documents,"" i.e. ePubs converted with Kindle Previewer/KindleGen, or books bought from Amazon. AFAIK, Calibre adds a fake ASIN and changes other metadata items so that books no longer appear in the Personal Documents folder. However, this change also causes the book to be displayed without a cover in the Kindle for PC/OSX apps. Everything works fine except the book covers don't show up in kindle app. There's no description also, so it's impossible to recognise which book I'm opening. To display the book titles, click the hamburger icon (≡) in the Kindle app toolbar."
"Is there any ebook reader that can synchronize the bookmarks across PC(windows, osx), iOS, android devices?","Google Play Books is probably what you are looking for. It synchronizes data between all your devices, allows you to upload your own ebooks and it supports epub format. "
More than one chapter div in one epub file?,"Kobo ereader devices have two different internal reading software. Ebooks downloaded from the Kobo bookstore are a modified epub format with the particular extension .kepub.epub, while if you sideload a standard epub from your PC it retains its original extension (.epub). By checking the extension of the files, the software automatically select the relative reading software (you don't normally notice many differences, they have some different internal features though). I had the same issue with page break html code and experimented a bit, and it seems that the .kepub.epub engine (the one used with books from the Kobo store) doesn't support it, so I think that there is not much you can do about it. A possible solution, like you have been suggested, could be to split the html file in multiple ones, exactly where you would have put the page break code. If you use Sigil or the Calibre internal editor you won't have to manually edit toc.ncx, contents.opf and all other files/references, because they will do automatically; it's an easy task, really. Please note that books bought from the Kobo bookstore are stored inside the device database and not as individual files."
Is there a way within the UI of the Kindle (Fire) to search only for books that can be borrowed?,"Yes, there is a way. Note, of course, that this feature is only available from an actual Kindle device, not from a reading app on a computer, phone or tablet not sold by Amazon. (Fwiw: I have a Kindle2, so your screen may differ from mine.) Take the action to ""Shop in Kindle Store"" on your device. (On the K2, that is located in the menu that appears when you press the ""menu"" button.) Under ""Browse / Books"" choose, ""see all categories ..."" The last option on the list is ""Kindle Owners' Lending Library"" Currently 494,389 titles are offered for lending (only one per month); a number of filters are available to reduce this deluge, which you can choose by selecting ""View Subcategories within Owners' Lending Library"". If you search or otherwise leave the confines of the Lending Library listings, any book lacking a ""Prime"" designation in the listings shown on your Kindle is not available for lending. Btw, once you've borrowed a book, you can read it in any Kindle reading app, not just the device you used when you borrowed it."
Are there any open e-book file formats that support statistics gathering?,"Note that companies controlling both the devices/apps and the store (e.g., Amazon or Kobo) perform analytics routinely, exactly because they can gather info from the reading system (app or device firmware). They even share their findings with the publishers (to make them ""optimize"" their eBooks, so that they can sell more) EDIT: see ""/data lessons/"", presentation by Tamblyn (Kobo) given at BiB12: http://youtu.be/eQfJ3NWiPmU Some guys tried to build a company (Hiptype) around the concept of ""google analytics"" for eBooks, but they did not succeed and went out of money. Their solution was basically embedding JS code into EPUB eBooks. This type of solution is quite doomed, because if the reading system disallows network communication (e.g., iBooks does), the ebook cannot ""phone home"" the reading statistics. The same holds true for remotely-hosted images (like those used to log the visitors of a web page). Finally, no ebook standard that I am aware of has explicit mechanisms to collect such statistics. And, even if they had, the actual availability of such a feature would be depending on the reading system implementer."
How to build ebooks from O'Reilly Atlas Projects?,"First, kudos to learning about a new tool. (I never heard of it).  The content creation environment is in closed beta, so I wouldn't expect there to be any way to access the source code.  But the reading portal lets you view the full HTML which is generated by the HTMLBook source. I'm guessing that they have a tool to import asciidoc into HTMLbook, but I'm not sure if it only imports a subset of ASCIIDOC elements.  I think the whole point of Atlas is to make it unnecessary to have access to the source code, and to provide readymade templates and styles. Building for epub, pdf and mobi is complex, and it would be hard to recreate their toolchain on your own production environment.  Based on the video I've seen, it looks very impressive and hopefully will be a single source competitor to Adobe Indesign. It's unclear whether storing the source on the cloud will allow you to download an offline copy of the source. I'm struck by the similarities between Docbook XML and the elements created through the editor. (Indeed, I suspect HTMLBook is based upon it). Even if you downloaded an offline copy on source, I'm unsure how you would build it yourself; (for example, it seems that Atlas uses a commercial  PDF processor from AntennaHouse, which most people wouldn't have a license for). One thing is clear though. If you have access to the HTML output, you could probably import it into some desktop ebook creation tool and change the styles as necessary. The generated HTML is very clean, so I would expect it not to be that painful.  One example of a down-and-dirty export is to paste the HTML output into a MS Word doc, make sure the images are all there and then convert it into a PDF. "
Is there a kindle with a light up screen but NOT a touchscreen?,"No
All the  currently available Kindles have a touchscreen.
One solution would be to buy an old kindle lighted cover "
Auto-adding to a Collection when using a Send-to-Kindle email,"Only thing you can control via email subject is whether to use Amazon's convert feature From https://www.amazon.com/sendtokindle/email PDFs can be converted to the Kindle format so you can take advantage of functionality such as variable font size, annotations, and Whispersync. To have a document converted to Kindle format, the subject line should be ""convert"" when e-mailing a personal document to your Send-to-Kindle address."
Embed JavaScript in an e-book using an e-reader,"JavaScript is an optional part of the epub 3.0 specification: EPUB Content Documents may contain scripting using the facilities
  defined for this in the respective underlying specifications ([HTML5]
  and [SVG]). What this means is that even a fully-compliant epub 3.0 device doesn't need to implement JavaScript support. The ones that do will generally be the ""more bells and whistles"" devices; the iPad, for example, supports JavaScript. The IDPF's epub Chrome extension Readium does as well. Note that according to the epub 3.0 specification, the following criteria for reading systems that support JavaScript must be met: › It must support container-constrained scripting and may support
  spine-level scripting. › It may render Scripted Content Documents as an interactive, scripted
  User Agent according to [HTML5]. › It must not allow a container-constrained script to modify the DOM
  of the parent Content Document or other contents in the EPUB
  Publication, and must not allow it to manipulate the size of its
  containing rectangle. (Note: Even if a script is not
  container-constrained, the Reading System may impose restrictions on
  modifications (see also the dom-manipulation feature).) › It may place additional limitations on the capabilities provided to
  scripts during execution (e.g., limiting networking). › It must implement the JavaScript navigator extension object
  epubReadingSystem defined in Appendix A, JavaScript epubReadingSystem
  Object . It also must support the dom-manipulation and layout-change
  features defined in Features in container-constrained scripting
  contexts. › It must regard the scripted [Publications301] property of the
  Package Document manifest item element as the authoritative definition
  of whether an EPUB Content Document includes scripting. EDIT: Popup text and images are definitely possible using JavaScript in iBooks. For an example, check out Beneath The Ink."
Is there an Android reading app that synchronizes across devices?,"Moon+ Reader can do this, storing the data in Dropbox or in Google Drive. (Note: I have not actually tried this functionality myself as I can't bear to use Moon+ due to its horrible UI and poor support for the ePub standard. But the feature is there in the settings, if you can find the right settings page...) Google Play Books does so too - but it does not directly open files stored on the device (you have to let it upload them to Google's servers and then download them again...)"
How can I set my Kindle Paperwhite to ignore font color settings?,"In the case you have bought pure ePub and later converted it to Mobi, you could delete the color attribute at all (Kindle will treat this with it’s built in color spec.). This needs unpacking of ePub, deleting the css part you have mentioned and proper packing into ePub again."
"I can't find the mobi format ebooks I copied from my computer to my kindle via usb, what should I do?","File size can be an issue. I've found that if the book's file size is greater than 50MB, the file will transfer to the documents folder on disk, but not appear on the kindle. In my case, I used Calibre to convert mobi to azw3, which reduced the file size, and the book then appeared on my kindle."
Keeping lines together in ePub,"You can use page-break-inside: avoid; in your CSS to keep information from breaking across pages where possible in a reflowable epub file, though not all reading systems will honor it. Another option would be using page-break-before: always; to force a page break before the content that you want to keep together. This is somewhat more widely supported, but still not universal. In the end, pagination is a relic of print and not something native to digital, so trying to force it might not be the most efficient way to go. Are there other ways you can accomplish the same end, perhaps with hyperlinks?"
Sort/Select chapters/paragraphs by POV,"Calibre's EpubSplit plugin should be able to do what you need, but as far as I know you have to manually select which chapters you want to extract."
How can I listen to non-Audible audiobooks on my Kindle?,"According to their FAQ section: Is Audiobooks.com mobile friendly?  It sure is! You can stream or
  download your favorite books from Audiobooks.com on your iPhone or
  iPad (iOS4.0 or higher), or Android smartphone (running version 2.3 or
  higher), via our native apps.  Thanks to our HTML5 web app, you can
  also listen to audio books using almost any other internet-enabled
  device, like laptops and tablets. We recommend that you check with
  your mobile provider to make sure you have a data plan. So if your Kindle supports web browsing (and has an HTML5 compatible browser), then yes you can. Otherwise, you are forced to use one of their native apps for the devices mentioned. Or another option as mentioned by DVK in the comments, you can turn your Kindle into a generic Android device. It's possible to do this because Kindle devices (and Nook for that matter) are using Android under the hood. Amazon (or Barnes and Knoble for the Nook) just design the stuff on top of Google's open-source operating system. Once you convert your device to a generic Android device, you can run the native Android app provided by audiobooks.com. As for how to change your device, if you choose that route, there are many tutorials out there. Here is one to get you started."
Are there ways to easily convert chapter-split books from popular fan-fiction sites into single e-book?,"You can use the GrabMyBooks Firefox extension. It can grab single web-pages and convert them to epub, or adding multiple pages as distinct chapters. There is also a Calibre plugin called FanFictionDownloader, but I've never used it."
