question,answer
Reading PDFs on Kindle device,"It is possible, but will need prior processing for optimal results. You can use the free tool k2pdfopt to optimize PDFs for your reader's display size. It can handle up to four columns, works with ""normal"" (using actual stings in the PDF) as well as scanned text and will turn your input PDF into a PDF with more pages optimized for your screen's size. Newer versions of the program can even text. Text reflow preserves images and even mathematical formulas -- which is something that Sony's built-in text reflow cannot do. Download the program, set the options for your reader on a Windows/Mac/Linux machine and generate a new PDF with only one column, cropped margins and possibly larger letters. The conversion progress is largely automatic, just give it a try. If you do not mind jailbreaking your reader, there are also PDF viewers that include k2pdfopt and so you can change font size and other parameters on the fly. These also have the advantage that you can use the PDF's table of contents (something the official PDF viewer does not support). The readers are all forked from the same project and only differ in how you input your data. They are KOReader (for Kobos, Pocketbooks, reMarkable and Kindles with a touch screens), KindlePDFViewer (for Kindles with keyboard) and Librerator (for Kindles with neither touch nor keyboard). A clear disadvantage is that these programs seem to drain more battery than the official PDF viewer, but on the other hand reading is more convenient, because you can still read in portrait mode and your pages are preprocessed in the background (turning pages feels faster in large PDFs with many images). And battery life is still several weeks. Other than this you can of course read in landscape mode. This can be quite annoying with multicolumn documents or if you want to go back just one page to look something up (may feel slow). It is fine for texts you read without going back and it's still the way to go e.g. if you have large tables in your document. I used it for text books as well for years, so it is not too annoying. Another option is converting the PDF to Mobi using Calibre or Amazon's mailing service. This will usually fail completely in multicolumn documents, will remove images and destroy mathematical formulas. It will also often lead to page numbers or chapter names (if it is written on top of every page) in between the text."
How can I convert an HTML site into an ebook?,"Of course you can. The easiest method is  Here's the official Amazon page documenting this feature. If it's not what you want, you can use Calibre to convert HTML to various ebook formats, here is the official documentation. And even more, you can download the official Kindlegen Linux CLI tool from Amazon and hand tailor the downloaded HTML with your favourite editor then convert it. (And you can download the official Python docs in EPUB format which Amazon happily convert for you (the mailing method), and every other conversion option I had mentioned above will work with the EPUB too.)"
Any way to find a lost Kindle inside a house?,"The OP's solution is below. Adding as a community wiki Answer and removing the solution edits from the Question. Found the Kindle using the sniffing technique described below. However I'd still like to know if there's a way to find it that's less overkill. I discovered that the Kindle updates its contents daily while in deep sleep around 5:30-6:30AM. So I set up the delivery of a biggish pdf file through the kindle email so I'd ensure a long enough connection, end set up three laptops with a Kali Linux running live with airodump sniffing packages (modified from here: http://www.androidauthority.com/capture-data-open-wi-fi-726356/  ) The following procedure can be used to physically find any active wifi device connected to a network: Three lines of code in the terminal in at least three Kali Linux running devices (2D location, at least 4 receivers out of plane for 3D): To start monitor mode on a wifi card (in this case wlan0, check on iwconfig if needed):   Airmon usually changes the card name to wlan[n]mon after this. Check the wifi interface name on iwconfig and modify accordingly if the next line returns a related error. Then run airodump to find your wifi network and its channel: Enter Ctrl-C to end the capture once you note the desired network's channel Run the following line to run airodump again only at the specified channel and record the data to the ""allthedata.csv"" file in the terminal directory (usually the root for a live cd/usb if you didn't change it). Replace the square brackets by the channel number: I started the pcs before going to sleep and as I woke up a bit past the usual update time, I hit ctrl-C to stop the capture and looked up the device on the allthedata.csv files by its MAC number which can be obtained at the router logs. There are in fact 4 allthedata files with different extensions per capture, and on the xml you can find the manufacturer of the device in the logs, so even if you don't know the mac address by looking up an Amazon branded device connected to your router you may find the Kindle entry. At the Kindle entry, find the signal strength value and note it for all the receiver computers.
Then convert the values from dbm to mW using the following formula: mW=10^(dBm/10)*1000. To triangulate the signal (for a 2D location), draw a chart with the position of the laptop wifi receivers and for every pair of receivers, draw a line perpendicular to the line going through the points in a point inversely proportional to the square root of the mW power values, as the signal drops of proportionally to the square of the distance (for 3D use at least 4 receivers and a surface between the points). The lines should cross at the source of the emission - the Kindle was at a closet in this case. The margin of error was about 1m/3ft even with several concrete/brick walls in between the receivers and the emission. Notes: This simplified location approach is only possible if the emitter is located in between the receivers, that is, a three-set of receivers (2D) form a triangle that has the emitter inside it. Different receivers might have different antenna gains and correcting for it will greatly increase accuracy. A quick and dirty way of doing so is positioning the receivers at the same position from a constant power emitter (wifi router, for example) and using the signal strength value difference between them as a calibration factor to be subtracted it from the signals received afterwards."
Is Markdown a viable source format for writing ebooks?,The answer is yes. You can use John MacFarlane's Pandoc to directly generate EPUB 2 or EPUB 3 from markdown.
Is there any software that facilitates scanning of a paper book into an ebook?,Tesseract is an open source OCR engine that gives fairly good results. It's my understanding that Google use it for Google Books. OCRFeeder is a project for document layout analysis that works as a nice GUI for Tesseract. Ocropus is another known open source OCR system.
How to create clickable table of contents in a PDF?,"Well, you could always buy a copy of Adobe Acrobat, which is actually designed solely for the purpose of creating and editing PDF files. Or you could import the file into Calibre, convert it to ePub format, edit the ePub to add the table of contents, then convert it back to PDF. There are other free tools for working with PDF directly. If you do a Google search, you would find this page which lists several free tools for editing or modifying PDF in various ways."
Clean up converted ebook,"Calibre has a feature that allows you to unpack an ePub file into the component parts (usually chapters), which you can then edit. When you have finished your edits, Calibre will repackage them back into an ePub file. From the main Calibre view, right click on the book listing. You should get a popup menu with an option to ""Edit book"". Selecting this will give you a book editing window where you can edit the individual parts of the book."
Are there any ebook search engines?,"The one I use is Luzme It queries several stores including Kobo, Amazon, B&N and in several countries. It then for each book shows the price that it last saw for each source and country. It is searchable by book name and author and series, although the series data is not complete as it comes from the stores. You can set up a wishlist of books and emails can be sent when they change price. This site does provide DRM status if the store makes that data available. The format is not shown however Amazon sites provide Kindle format and others at least ePub - I would be interested in any exceptions"
What information does my Kindle share with Amazon?,"Hard to guess what information sends or what the device can do when connected via WiFi when this information is not open and probable it will not be.  Take as an example this incident( article excerpt/ my emphasis): Amazon Erases Orwell Books From Kindle ... Digital books bought for the Kindle are sent to it over a wireless
  network. Amazon can also use that network to synchronize electronic
  books between devices — and apparently to make them vanish. ... and also this incident where the account was also closed(excerpt/my emphasis): Why did amazon close a woman’s account and delete all her kindle books? ... According to Amazon’s terms of use, “Kindle Content is licensed, not
  sold, to you by the Content Provider.” It states that “Risk of loss
  for Kindle Content transfers when you download or access the Kindle
  Content.” ... This are by no means isolated, and are a far cry from the Privacy Notice you mentioned, and made me keep always the Wi-Fi off and backup my documents."
If I buy a Kindle Paperwhite do I have to get books from Amazon?,"Kindle devices allow you to load non-Amazon files onto them; you can copy them directly to your device using a micro-USB cable, or have them sent to your device wirelessly, through Amazon's Kindle Personal Documents service. You are limited to the types of files supported on the Kindle: at present, these are .azw, .azw1, .txt, .mobi, and .prc. In addition, Kindle can read .pdf files (but these keep the pre-formatted paging and layout of the original file, rather than the dynamic/flowing text of an ebook.) It is extremely easy to convert files into Kindle-supported formats from other popular formats -- such as .epub files, Word documents, and web pages. Amazon's Personal Documents Service can help you with transfer and conversion, and Calibre is an extremely popular tool for ebook-management which provides such conversions easily. PDF files which are mostly text are also quite easy to convert to a supported ebook format. The one big wrinkle in the all-around compatibility I'm describing here is that books protected by DRM (a Digital Rights Management scheme), the DRM prevents it from being converted into different formats. So an ebook you buy at barnesandnoble.com, which is formatted and protected exclusively for the B&N Nook e-reader, cannot be easily converted for the Kindle.  Many major ebook retailers rely on DRM to help ""lock you in"" to their specific device, platform, and store. So basically, ebooks you get at non-Amazon stores are unlikely to be compatible with the Kindle (unless they specifically note that the ebook has no DRM), whereas ebooks from other sources (e.g. the out-of-copyright classics at Project Gutenberg, or ebooks you create yourself using a service like Instapaper) should present no difficulty."
How does the Kindle's reading rate algorithm work?,"I realize this is quite an old question, but I can provide some more detailed information.  My source of this information is a combination of Kindle log files and de-compiled Java classes for the ReadingTimer package. There is a lot of detail behind the statistical methods they use to avoid incorporating outliers into their calculations that I have uncovered - but I won't go into that detail here. Basically, every time that you turn a ""page"" on a kindle, they capture the time you spent on the page (in milliseconds), and the number of words on each page.  They call this an ""Interval"". They calculate an Interval words per minute (WPM), and if that calculated WPM is > 900, they exclude that observation from the sampling methodology they use.  If the WPM value is < 900 - well then it gets complicated. It's nowhere near as simple as just averaging together all of the IntervalWPM observations.  There are outlier discovery, normal distribution, z-score testing and other statistical methods utilized. But, from a drastically oversimplified perspective, those Interval WPM's are used to construct a statistically robust TotalWPM.  That TotalWPM is, roughly, the average (but not really the average) WPM for the specific book you are reading. So, bottom line, they do actually have a limit on how fast someone could read: 900 WPM - which is about 3.5 times more than the commonly recognized average reading rate of a random individual (native English speaker reading English). And on the flipside, they do not technically have a limit on how slow someone could read.  What they have is a limit on how much slower someone reads any specific page relative to their normal reading rate (which is tracked across books by using something called the GlobalWPM).  So - if you start with a fresh kindle and only read 2 words per minute, that will be your acceptable baseline rate. I have, of course, drastically oversimplified what's going on behind the scenes.  The ReadingTimer code is fairly complex, and with how much information is lost between a decompiled Java class and the original Java code - figuring out what its doing is quite time consuming. Hope that helps."
Are there any WYSIWYG editors for EPUB books?,"When someone asks me what GUI to use I suggest Sigil. I find that Sigil, unlike it's alternatives, does not add unneeded code to your ePubs which cause bloating, errors, and slower viewing.  Its code is also on github."
What are the differences between EPUB2 and EPUB3?,"According to this page, EPUB3 adds, changes or improves: Things that have been removed:"
Does a “one-fits-all” file format exist or should I offer multiple ebook formats?,"Virtually all e-book readers can display PDF files. Unfortunately, PDF documents are ""pre-rendered"" - the text is positioned on the page in absolute coordinates and text cannot reflow on smaller / larger devices (without hacks or trickery that rarely work well). TXT files are a good option if formatting isn't a concern. Most e-book readers can display TXT files (I just double-checked that they work out-of-the-box on my Kindle Touch). The downside, of course, is that you cannot use any formatting. This leaves you with two common formats: This page displays a table of devices and their supported formats. I would actually suggest a completely different approach - produce content using a markup language (like Markdown or HTML) and then use a tool to convert the files to the e-book formats you wish to support. Tools like Calibre support nearly every format under the sun, so you can choose as many formats as you want."
Updating EPUB book author and title metadata,"As you are on Linux, the way to do this is to change to the directory at the base of your library and do: This way you polish them all in one go."
How do I publish a book permanently free on Amazon,"Amazon does still do the price matching, and that is the only way to get your book listed as free on their site. The advantage of Smashwords is in distributing to Apple and Sony. If you go to your e-book's details page on Amazon, you will see a link that says ""tell us about a lower price"". You can click that link and provide them a link to the product page for your free book at one of the other sites, and eventually they will match it. Again, this seems to be more effective with Apple and Sony. The process may take a week or two, so if you can get others to click that link and share the news, it will help speed things up. If you want to make your book free for a limited time or on a specific date, I would definitely NOT recommend this approach. There is no way to control how quickly or when Amazon will respond, so you won't be able to determine the specific date(s). Also, if you think you may want to raise the price back up after a while, I would not recommend doing this. I have one title that I published under a pseudonym that has been free for months, in spite of the fact that I have raised the price on all other sites and tried repeatedly to get Amazon to raise the price. "
If a book doesn't have DRM does that mean it is OK to give a copy to my friend to read?,"NO! Every eBook is released under a licence.  Even if there is no licence specifically identified then it is covered under the general copyright law.  If you purchased the book and it was not released under a licence that permits redistribution then you should assume that giving away copies to friends is forbidden. Generally you can find the licence that the book was released under listed in the first few pages of the book, usually before any of the main content.  There are some licences that permit redistribution either for a fee or not.  Most licencing restricts distribution to those people who have a specific distribution licence and pay the appropriate royalties and fees to the publisher and author. There is some question about older books that are public domain.  The content of the book(the text) is the only thing that is public domain.  The Ebook has added markup and is covered under copyright laws as a new creation.  You can still use the public domain content as permitted, but the markup and any images included that are not public domain images are covered.  Also just because you are in a country that may not enforce copyright and licencing from the country of origin, does not mean that the copyright does not exist. In real world terms, think of it as an analogy to walking down a street and seeing a house that has no door lock. Is it OK to enter the house and take anything in it, just because there's no door lock preventing you from doing so? No.  And even if the police will not arrest you that does not mean that it is acceptable to do so."
"How to synchronize Kindle collections across all devices, including older Kindles?","I am guessing you have already found Amazon's Organizing Your Kindle Content.  If every book on your devices is from Amazon, then you can do some organizing at 'Your Account' > 'Manage Your Device' > 'Your Kindle Library' or by using the cloud.  If you have works from anyplace else, then the prospects get worse. I personally have some OCD issues that require my books be in some kind of order that is not primary based on who I bought it from and when.  I was trying to keep track organized with an Excel book.  I searched for solutions and read many articles & blogs, I strongly desired an Amazon/Kindle solution, the majority pointed to a single solution which I eventually adopted.  Calibre is that solution.  The only disadvantage the Calibre has it is a bit more difficult to connect wirelessly to your collection. I won't go into all it's advantages but, essentially it is your own personal library, that you can organize and store you books on, regardless of where it comes from.  My 1263 (current count) works are stored on Calibre, I download from Amazon, Smashword, Baen, Project Gutenberg, etc. directly to Calibre (on my pc).  Once a week or so, I sit down at the PC, remove some books from my Kindles, mark them as read on Calibre (tag 'read'), add some new books to the appropriate kindle ('paperwhite' for reading in bed, 'keyboard' for text to speech while commuting) and tag the books I am currently reading in Calibre by the device they are on. I believe there is at least one wireless solution for connecting your Kindle to your Calibre, but in the end I stuck with using the USB connection, as by the time I need to move some books around, I need a recharge, so i get a two for one deal (load and charge)."
What commands can be given in the Kindle's search box?,"At least the following are supposed to work, although I haven't verified them: As @Tim pointed out in the comments, ~usbNetwork is non-standard, and some of the other ""searches"" on here may be hacks that require installation of additional software. The following may be Touch-only; I can't verify this: The following are apparently Paperwhite-only, but I can't verify this: Source Here is an interesting tutorial on how to root your Kindle (not directly relevant to the question, in that it's not just a list of search commands, but relevant to Kindle hacking generally)."
When shopping for ebooks on Amazon how do I tell if they have DRM?,"Books that have ""Simultaneous Device Usage: Unlimited"" listed under ""Product Details"" do not have DRM (Digital rights management). Those without this disclaimer have DRM.  "
What are my options for reading an ebook in the bathtub?,"Waterfi sells waterproofed Kindle paperwhite. It's rather expensive ( approx. $100 more than a non-waterproofed Kindle ), here you can find a video review. "
Are there good ebook management tools available for free?,"Calibre is a free and open source e-book library management application available. You can download from here which is available for all operating systems. Adobe Digital Editions is also one of the e-book manager by Adobe. You can access it from here. Alfa Ebooks Manager features a lot of templates and options for library vizualization. Besides, it allows to update book data from multiple web sources (like Amazon, Google Books, Barnes & Nobel, etc). It's also good at file management and metadata extraction. You can download it from here. Delicious Library's a bit different. Actually it's a software not just for books but for managing all stuff at your home. It's greates feature - entering books via webcam shot (it recognizes ISBN code). This feature makes Delicious Library the best software for collecting paper books. You can see the details from here. And if you are a mac user Delicious Library is the best e-book manager but unfortunately it's not free. Second priority I will give to Alfa eBooks Manager. Hope it will help!"
How to repack an epub file from command line,Without -X you could get the following when validating it with EpubCheck: If mimetype is not the first in the epub file EpubCheck prints the following:
Can EPUB 3.0 be viewed on EPUB 2 devices,"The IDPF states the following in a thread about EPUB 3 Rendering in EPUB 2 reading systems Although EPUB 3 is not perfectly backwards compatible with EPUB 2, a goal of the recent revision was to ensure, as much as possible, a basic level of rendering when features overlap. The thread particularly mentions that providing the NCX data is necessary, which has been superseded with EPUB Navigation Documents
as described in the EPUB 3 changes document So, if some care is taken, EPUB 3 files can be made to render on EPUB 2 reading systems."
How can I reduce the resolution of images in an epub or mobi file?,I had a similar situation: a 134 MB .mobi that I wanted to shrink. Here's how I reduced the file size to 26 MB.  The key to this approach is that an .epub is actually just a zipped web page with image files in it.
How do I shop for only DRM free books on Amazon?,"Since Amazon does not seem to let you search for this, you might want to use google: Google for DRM-free thrillers"
What is the minimum required content for a valid ePub?,"Here's an epub 3.0 file that validates with epubcheck 3.0.1 (the current version at the time of writing). There's plenty more info that can (and should) go in there, of course, but you asked for minimums. We'll start with file structure:  in the root directory, there's one mimetype file and two folders--the OEBPS and the META-INF. Here's the mimetype file contents: be sure not to have any return/line break characters in there.
In the META-INF folder, there's one file, the container.xml: In the OEBPS folder, things get slightly more complex. First is the content.opf file: Then comes the toc.xhtml file: And finally we have the content of the ebook itself, in this case 1_hello.xhtml: As a bonus, there's a toc.ncx file. This is not required to be valid, but it's required if you want the book to have a working Table of Contents on epub 2.0.1 devices (which is pretty much all of them): And there's also the template.css in there, which is just a CSS stylesheet. In this case, it looks like this: And that's it! For more complex stuff, there are a number of free epub 3 samples available at https://code.google.com/p/epub-samples/."
How is an epub structured internally?,EPUB is an open format so you can find the standard specifications online. Wikipedia has a good article on the EPUB format.  If you want a brief description of the characteristics you just mentioned you can find in this article here. Directory structure: Needed files: And which information is contained in each file is described in the above mentioned article.
How do I convert a Word document into a page by page Kindle ebook?,"To convert a .docx file to another format, you should download a program called Calibre First you must add the .docx file to your Calibre library
 Then you need to select the book, and click on Convert books
 Select your output format (for Amazon Kindle, select AZW3), and click OK. After it has completed, the newly converted ebook will appear in your Calibre library folder
"
